Title,Project ID,Logline,Genre,Lane,Creator/Author/Director,Priority Score,Subgenre/Tags,Urgency Label,Discovery Stage,Country/Language,Platform/Source,Why It Matters,Signal/Proof,Source Link,Rights Status,Rights Holder,Contact/Rep,Adaptation Format,Comps,Heat Score,Concept Score,Adaptability Score,Rights Opportunity Score,Studio Fit Score,Next Action Status,Owner,Next Step,Last Updated,Notes,Project Cover,Search Keywords,Original Release / Publication Date,My Picks,Action Items,Country,Votes,Year Written,Script Status,Format,Script PDF
Hot Mess,P-0588,"Sandy was once a formidable investigative reporter until a bungled story destroyed her credibility and forced her into the soul-sucking world of tabloid gossip–now her days are spent covering hot mess celebrity Margot Ford. When a disillusioned Sandy is called to Fiji to follow Margot's latest hijinks, she discovers a surprise about Margot's real identity, which sends her on an adventure she never imagined, as the two must team up to take down a massive, sinister corporate plot with global implications, all taking place at a luxury island resort.",Comedy,Unproduced Script,Shanrah Wakefield,0,,Low,,,,,,https://8flix.com/scripts/unproduced/2023-part-3#hot-mess,,,,,,,,,,,,Adam,,,On the 2023 Black List.,,,,,,,18,2023,Unproduced,Feature,
If I Had Your Face,P-0589,"When Jo's best friend, Rina starts dating a white man, she begins transforming into something different: a white woman. Through it all, Jo can't seem to convince anyone that there is cause for concern. But when three unidentifiable white women turn up dead, Jo realizes that they had all been Asian women who dated the same man, and now that he has Rina in his sights, it's up to Jo to save her before she becomes his next victim.",Horror,Unproduced Script,Ran Ran Wang,0,,Low,,,,,,https://8flix.com/scripts/unproduced/2023-part-3#if-i-had-your-face,,,,,,,,,,,,Adam,,,On the 2023 Black List.,,,,,,,9,2023,Unproduced,Feature,
Immune,P-0590,"The story of Dr. Maurice Hilleman, the brilliant father of modern vaccines, who by deftly negotiating corporate politics, prevented a deadly pandemic and created the groundbreaking vaccines for measles, mumps, rubella, chicken pox and many others that still save eight million lives a year worldwide.",Drama,Unproduced Script,Daniel Persitz,0,,Low,,,,,,https://8flix.com/scripts/unproduced/2023-part-3#immune,,,,,,,,,,,,Adam,,,On the 2023 Black List. Based on the life of vaccine pioneer Dr. Maurice Hilleman.,,,,,,,9,2023,Unproduced,Feature,
Kazan,P-0591,"The story of the tumultuous relationship between Arthur Miller and Elia Kazan–born out of the success of DEATH OF A SALESMAN and destroyed when Elia Kazan named names to the House Committee on Un-American Activities, resulting in two of the greatest works of the 20th century: THE CRUCIBLE and ON THE WATERFRONT.",Drama,Unproduced Script,Chris Parizo,0,,Low,,,,,,https://8flix.com/scripts/unproduced/2023-part-3#kazan,,,,,,,,,,,,Adam,,,On the 2023 Black List. Based on the real relationship between Arthur Miller and Elia Kazan.,,,,,,,9,2023,Unproduced,Feature,
Last Resort,P-0592,"When a grieving woman takes a trip to a posh, Icelandic resort designed to assist its guests with ending their lives, she meets people who finally force her to accept the things she cannot explain.",Drama,Unproduced Script,Laura Stoltz,0,,Low,,,,,,https://8flix.com/scripts/unproduced/2023-part-4#last-resort,,,,,,,,,,,,Adam,,,On the 2023 Black List.,,,,,,,11,2023,Unproduced,Feature,
The Last Tower,P-0593,"When a disaster strikes, a family is trapped in their high-rise Miami hotel. With danger closing in fast, they're left with only one way to go: Up.",Thriller,Unproduced Script,Aaron Sala,0,,Low,,,,,,https://8flix.com/scripts/unproduced/2023-part-4#last-tower-the,,,,,,,,,,,,Adam,,,On the 2023 Black List.,,,,,,,10,2023,Unproduced,Feature,
The Light at the End,P-0594,"When a solar event fills the sky with endless light that kills everything it touches, a young woman must find a way to escape the house where she is trapped with a doomsday cultist.",Horror,Unproduced Script,Arun Croll,0,,Low,,,,,,https://8flix.com/scripts/unproduced/2023-part-4#light-at-the-end-the,,,,,,,,,,,,Adam,,,On the 2023 Black List.,,,,,,,11,2023,Unproduced,Feature,
Love and War and Guernica,P-0595,"Against the backdrop of a present-day, war-torn America, a dark comedy about Neil Mudd, a reporter for the Union suffering from writer's block ever since his break-up, and his engaging with a mysterious horse following him through war-torn Los Feliz, California. When the Union recruits Neil for a top secret mission, he and the horse go on an epic journey that, emotionally, serves as a metaphor for the war going on inside Neil's heart.",Comedy,Unproduced Script,Sam Zvibelman,0,,Low,,,,,,https://8flix.com/scripts/unproduced/2023-part-4#love-and-war-and-guernica,,,,,,,,,,,,Adam,,,On the 2023 Black List.,,,,,,,14,2023,Unproduced,Feature,
Lure,P-0596,"When a park ranger ventures into the wilderness to find a missing hiker before a storm, she finds herself lured into the woods by a dangerous, unearthly predator mimicking her dead daughter.",Horror,Unproduced Script,Nick Tassoni,0,,Low,,,,,,https://8flix.com/scripts/unproduced/2023-part-4#lure,,,,,,,,,,,,Adam,,,On the 2023 Black List.,,,,,,,8,2023,Unproduced,Feature,
The Masque of the Red Death,P-0597,"A grotesquely hilarious dark comedy based on Edgar Allan Poe's short story ""The Masque of the Red Death.""",Horror,Unproduced Script,Charlie Polinger,0,,Low,,,,,,https://8flix.com/scripts/unproduced/2023-part-4#masque-of-the-red-death-the,,,,,,,,,,,,Adam,,,On the 2023 Black List. Based on Edgar Allan Poe's short story.,,,,,,,13,2023,Unproduced,Feature,
Molepeople,P-0598,"When an unhoused teen turns up brutally murdered, his estranged brother searches for answers in the underworld of New York City and uncovers a series of horrifying crimes hiding deep in the abandoned subway systems.",Thriller,Unproduced Script,Nathan Elston,0,,Low,,,,,,https://8flix.com/scripts/unproduced/2023-part-4#molepeople,,,,,,,,,,,,Adam,,,On the 2023 Black List.,,,,,,,7,2023,Unproduced,Feature,
The Nest,P-0599,"Confined to ""the nest,"" a Secret Service Sniper gets a strange call on the radio from a deranged mastermind who's holding his family hostage in a box suite during America's biggest game -- The Super Bowl.",Thriller,Unproduced Script,Aaron Benjamin,0,,Low,,,,,,https://8flix.com/scripts/unproduced/2023-part-4#nest-the,,,,,,,,,,,,Adam,,,On the 2023 Black List.,,,,,,,17,2023,Unproduced,Feature,
The Nowhere Game,P-0600,"Two young women are kidnapped, brought deep into the woods, given a head start, and then hunted down by their sadistic captor all for the pleasure of the online fans of ""The Nowhere Game.""",Thriller,Unproduced Script,Alex Pototsky,0,,Low,,,,,,https://8flix.com/scripts/unproduced/2023-part-4#nowhere-game-the,,,,,,,,,,,,Adam,,,On the 2023 Black List.,,,,,,,9,2023,Unproduced,Feature,
Old Time Hockey,P-0601,A forty-three-year-old snowplow driver decides to get his high school hockey team back together to play a state championship game.,Sports,Unproduced Script,Kevin Jakubowski,0,,Low,,,,,,https://8flix.com/scripts/unproduced/2023-part-4#old-time-hockey,,,,,,,,,,,,Adam,,,On the 2023 Black List.,,,,,,,7,2023,Unproduced,Feature,
Our House,P-0602,"When she wins an essay competition, Leila Moseley is brought to Capitol Hill to be honored by the United States Congress, but her luck runs out when the ceremony intersects with a violent insurrection, and she must team up with a group of aides, interns, and nepo babies to battle for survival against a legion of protesters and a secret society.",Thriller,Unproduced Script,Will Youmans,0,,Low,,,,,,https://8flix.com/scripts/unproduced/2023-part-4#our-house,,,,,,,,,,,,Adam,,,On the 2023 Black List.,,,,,,,12,2023,Unproduced,Feature,
Our Man in Miami,P-0603,A Miami construction contractor transforms into a notorious sports agent when he hatches a high-stakes scheme to steal Fidel Castro's most prized assets–Cuban baseball players–for the New York Yankees. Based on the wild true story.,Drama,Unproduced Script,Ozzy Inguanzo,0,,Low,,,,,,https://8flix.com/scripts/unproduced/2023-part-4#our-man-in-miami,,,,,,,,,,,,Adam,,,On the 2023 Black List. Based on a true story.,,,,,,,12,2023,Unproduced,Feature,
Palette,P-0604,"A woman who discovers she is suffering from severe synesthesia gets recruited into the secretive, cult-like industry of color design by a mysterious corporation but then uncovers the bloody, dark, and twisted reality of what it really takes to make the world's next great hues.",Horror,Unproduced Script,Zach Strauss,0,,Low,,,,,,https://8flix.com/scripts/unproduced/2023-part-5#palette,,,,,,,,,,,,Adam,,,On the 2023 Black List.,,,,,,,9,2023,Unproduced,Feature,
Patsy,P-0605,"The untold and unfiltered true story of legendary country singer Patsy Cline, from her humble beginnings in Virginia to her untimely death at the height of her fame.",Drama,Unproduced Script,Filipe Coutinho,0,,Low,,,,,,https://8flix.com/scripts/unproduced/2023-part-5#patsy,,,,,,,,,,,,Adam,,,On the 2023 Black List — #7 overall. Based on the life of Patsy Cline.,,,,,,,21,2023,Unproduced,Feature,
The Peasant,P-0606,"In the 14th Century, a lone shepherd rages against a company of mercenary knights after they ransack his peaceful peasant community, proving that he is more than he seems.",Action,Unproduced Script,Will Dunn,0,,Low,,,,,,https://8flix.com/scripts/unproduced/2023-part-5#peasant-the,,,,,,,,,,,,Adam,,,On the 2023 Black List.,,,,,,,12,2023,Unproduced,Feature,
The Pentester,P-0607,"When a pentester with a perfect track record for breaching his clients' security systems takes an unusually high-paying job, his success proves to be in vain as he finds himself in the middle of a deadly conspiracy where the only way out is forward.",Thriller,Unproduced Script,Jesse Quiñones,0,,Low,,,,,,https://8flix.com/scripts/unproduced/2023-part-5#pentester-the,,,,,,,,,,,,Adam,,,On the 2023 Black List.,,,,,,,12,2023,Unproduced,Feature,
People Walk Dogs Late at Night in the Suburbs,P-0608,A charming high school math teacher - about to be a father - comes up with a plan to course correct his life after having an affair with his student.,Drama,Unproduced Script,Drake Wootton,0,,Low,,,,,,https://8flix.com/scripts/unproduced/2023-part-5#people-walk-dogs-late-at-night-in-the-suburbs,,,,,,,,,,,,Adam,,,On the 2023 Black List.,,,,,,,7,2023,Unproduced,Feature,
Personal Best,P-0609,"Based on the true story of James Hogue, a talented student and long-distance runner who was admitted to Princeton University under the false identity of ""Alexi Indris-Santana""–an orphaned, self-educated, teenage ranch hand.",Drama,Unproduced Script,Ryan Hoang Williams,0,,Low,,,,,,https://8flix.com/scripts/unproduced/2023-part-5#personal-best,,,,,,,,,,,,Adam,,,On the 2023 Black List. Based on the true story of James Hogue.,,,,,,,10,2023,Unproduced,Feature,
Please Come Back,P-0610,A young couple who perform rituals to raise people from the dead get more than they bargained for when they attempt to re-animate a young girl who doesn't remember how she died.,Horror,Unproduced Script,Mike George,0,,Low,,,,,,https://8flix.com/scripts/unproduced/2023-part-5#please-come-back,,,,,,,,,,,,Adam,,,On the 2023 Black List.,,,,,,,7,2023,Unproduced,Feature,
Polo,P-0611,"When a young woman returns home from the Navy, she joins a local water polo team and finds herself fighting a new battle.",Drama,Unproduced Script,Nika Burnett,0,,Low,,,,,,https://8flix.com/scripts/unproduced/2023-part-5#polo,,,,,,,,,,,,Adam,,,On the 2023 Black List.,,,,,,,17,2023,Unproduced,Feature,
The Profit,P-0612,"The astonishing true story of how an unknown, evangelical Christian immigrant, Bill Hwang, suffered the greatest loss of wealth in American history, gambling away his $35 billion fortune and jeopardizing the entire financial system in under forty eight hours.",Drama,Unproduced Script,Andrew Ferguson,0,,Low,,,,,,https://8flix.com/scripts/unproduced/2023-part-5#profit-the,,,,,,,,,,,,Adam,,,On the 2023 Black List. Based on the true story of Bill Hwang and Archegos.,,,,,,,16,2023,Unproduced,Feature,
Propel,P-0613,A commercial diver fights to survive after a boating accident leaves her for dead underwater.,Thriller,Unproduced Script,Jeremy Marwick,0,,Low,,,,,,https://8flix.com/scripts/unproduced/2023-part-5#propel,,,,,,,,,,,,Adam,,,On the 2023 Black List.,,,,,,,7,2023,Unproduced,Feature,
Roses,P-0615,A married man takes his girlfriend on a romantic getaway to a villa. There is a swimming pool.,Drama,Unproduced Script,Evan Twohy,0,,Low,,,,,,https://8flix.com/scripts/unproduced/2023-part-5#roses,,,,,,,,,,,,Adam,,,"On the 2023 Black List. | Also on ScriptShadow — Carson Reeves' 'My Top 25' (all-time; ~#7, as of Jul 2026).",,,,,,,8,2023,Unproduced,Feature,
Sea Dogs,P-0617,"After two down-on-their-luck lobster fishermen botch a hijacking attempt on the high seas, they are forced to confront the consequences of their actions as they struggle to navigate a world they no longer recognize.",Drama,Unproduced Script,Josh Woolf,0,,Low,,,,,,https://8flix.com/scripts/unproduced/2023-part-6#sea-dogs,,,,,,,,,,,,Adam,,,On the 2023 Black List.,,,,,,,11,2023,Unproduced,Feature,
Spoiler,P-0618,"After passing on a hot new screenplay, a studio executive finds himself trapped as the protagonist inside the film and must regain control before the credits roll.",Comedy,Unproduced Script,Jordan Rosenbloom,0,,Low,,,,,,https://8flix.com/scripts/unproduced/2023-part-6#spoiler,,,,,,,,,,,,Adam,,,On the 2023 Black List — #3 overall.,,,,,,,42,2023,Unproduced,Feature,
Stakehorse,P-0619,A racetrack veterinarian who runs an off-the-books ER for criminals finds his practice and life in jeopardy when he's recruited for his patient's heist.,Thriller,Unproduced Script,Justin Piasecki,0,,Low,,,,,,https://8flix.com/scripts/unproduced/2023-part-6#stakehorse,,,,,,,,,,,,Adam,,,On the 2023 Black List — #2 overall.,,,,,,,47,2023,Unproduced,Feature,
The Stratford Wife,P-0620,"Anne Hathaway, a rebellious woman who has a way with words, weds William Shakespeare, an aspiring actor ten years her junior. They form a plan to sell her plays anonymously. But when William travels to London, Anne is stunned to learn he takes all the credit for himself, leaving her to forever live in the shadow of the greatest playwright to ever live.",Drama,Unproduced Script,Sarah E. Sinclair,0,,Low,,,,,,https://8flix.com/scripts/unproduced/2023-part-6#stratford-wife-the,,,,,,,,,,,,Adam,,,On the 2023 Black List.,,,,,,,8,2023,Unproduced,Feature,
Sundown,P-0621,"Monsters that roam in daylight keep a small, rural family confined to a nocturnal lifestyle. But when their son starts to question the monsters' existence, his parents must see how far they're willing to go to keep him safe.",Horror,Unproduced Script,Nick Hurwitch,0,,Low,,,,,,https://8flix.com/scripts/unproduced/2023-part-6#sundown,,,,,,,,,,,,Adam,,,On the 2023 Black List.,,,,,,,8,2023,Unproduced,Feature,
Toxoplasmosis,P-0622,"The classic story of boy meets girl, boy loses girl... boy forms unexpected bromance with girl's cat, who may actually be an intergalactic emissary sent to save humanity from itself.",Comedy,Unproduced Script,Andrew Nunnelly,0,,Low,,,,,,https://8flix.com/scripts/unproduced/2023-part-6#toxoplasmosis,,,,,,,,,,,,Adam,,,On the 2023 Black List.,,,,,,,13,2023,Unproduced,Feature,
U.P.S.E.T.,P-0623,"Two border cops in Michigan's Upper Peninsula find themselves in the crosshairs of Canadian biker gangs, international drug cartels, and shady government agents after intercepting a drug deal gone bad–all the day after an awkward one-night stand.",Action,Unproduced Script,Ben Bolea,0,,Low,,,,,,https://8flix.com/scripts/unproduced/2023-part-6#u-p-s-e-t,,,,,,,,,,,,Adam,,,On the 2023 Black List.,,,,,,,13,2023,Unproduced,Feature,
Undying,P-0624,"A woman, suffocated by motherhood, has an affair with a man she hasn't seen since high school -- only to discover he has been dead for years.",Horror,Unproduced Script,Ben Ketai,0,,Low,,,,,,https://8flix.com/scripts/unproduced/2023-part-6#undying,,,,,,,,,,,,Adam,,,On the 2023 Black List.,,,,,,,10,2023,Unproduced,Feature,
Untitled Missing Child,P-0626,"A mom-fluencer's life unravels when her child goes missing and an unexpected discovery mires the investigation in a battle of perception. With buried secrets exposed, our mom is forced to take matters into her own hands, turning a simple missing person's case into a story with twists that even the internet wouldn't believe.",Thriller,Unproduced Script,Brenna Galvin,0,,Low,,,,,,https://8flix.com/scripts/unproduced/2023-part-6#untitled-missing-child,,,,,,,,,,,,Adam,,,On the 2023 Black List.,,,,,,,,2023,Unproduced,Feature,
We Got Next,P-0627,The true story of how one daring executive beat the odds to launch the longest-running league in women's sports: the WNBA.,Drama,Unproduced Script,"Aaron Goldberg, Alex Goldberg & Michael Goldberg",0,,Low,,,,,,https://8flix.com/scripts/unproduced/2023-part-6#we-got-next,,,,,,,,,,,,Adam,,,On the 2023 Black List. Based on the true story of the WNBA's founding.,,,,,,,17,2023,Unproduced,Feature,
What's My Age Again?,P-0628,"The true story of Kansas teenager Jack Bergeson's meteoric rise and fall after he discovered a loophole in the state's constitution that allowed him to run for governor, inciting a statewide youth movement that changed politics forever.",Comedy,Unproduced Script,Jackson Kellard,0,,Low,,,,,,https://8flix.com/scripts/unproduced/2023-part-6#whats-my-age-again,,,,,,,,,,,,Adam,,,On the 2023 Black List. Based on a true story.,,,,,,,13,2023,Unproduced,Feature,
The Wolf in Chiefs Clothing,P-0629,"A lovable loser from a family of criminals becomes the Kansas City Chiefs' most famous superfan. His newfound status is expensive, so he teams up with his imaginary friend–an anthropomorphic version of the team's wolf mascot–and goes on a bank-robbing spree.",Comedy,Unproduced Script,Adam Best,0,,Low,,,,,,https://8flix.com/scripts/unproduced/2023-part-6#wolf-in-chiefs-clothing-the,,,,,,,,,,,,Adam,,,On the 2023 Black List.,,,,,,,11,2023,Unproduced,Feature,
Woodwork,P-0630,"While settling his mother's estate, awkward loner James reunites with his long-lost brother Rob who oozes wealth, charm, and confidence–but the chance encounter leads to a twisted game of wits and violence.",Thriller,Unproduced Script,Abiel Bruhn,0,,Low,,,,,,https://8flix.com/scripts/unproduced/2023-part-6#woodwork,,,,,,,,,,,,Adam,,,On the 2023 Black List.,,,,,,,8,2023,Unproduced,Feature,
42.6 Years,P-0631,"After waking up from a failed experimental lifesaving procedure in which he was cryogenically frozen for 42.6 years, a young man realizes he wants his ex-girlfriend back. He'll have to overcome the fact that while he hasn't aged a day, she's lived an entire life without him.",Sci-Fi,Unproduced Script,Seth Reiss,0,,Low,,,,,,https://8flix.com/scripts/unproduced/2022-part-1#t-42-6-years,,,,,,,,,,,,Adam,,,On the 2022 Black List.,,,,,,,7,2022,Unproduced,Feature,
The Americano,P-0632,"An everyday guy who accidentally starts working as a barista inside the CIA headquarters building gets lured into a spy mission by a beautiful secret agent, known only to him as Caramel Macchiato.",Comedy,Unproduced Script,Nico Bellamy & Chase Pestano,0,,Low,,,,,,https://8flix.com/scripts/unproduced/2022-part-1#americano-the,,,,,,,,,,,,Adam,,,On the 2022 Black List.,,,,,,,12,2022,Unproduced,Feature,
An Oakland Holiday,P-0633,"When a neglected and lonely Southeast Asian Princess goes undercover in an Oakland high school to live out her dream of being a normal teen, she discovers that happy endings come with many hard lessons about life, love, and humility.",Comedy,Unproduced Script,Yudho Aditya & Emma Dudley,0,,Low,,,,,,https://8flix.com/scripts/unproduced/2022-part-1#an-oakland-holiday,,,,,,,,,,,,Adam,,,On the 2022 Black List.,,,,,,,8,2022,Unproduced,Feature,
Baby Boom,P-0634,"When her sister's gender reveal party triggers the apocalypse, a woman and her husband have to prove to themselves, and the world, that they're responsible enough to save it.",Comedy,Unproduced Script,Jack Waz,0,,Low,,,,,,https://8flix.com/scripts/unproduced/2022-part-1#baby-boom,,,,,,,,,,,,Adam,,,On the 2022 Black List — #10 overall.,,,,,,,17,2022,Unproduced,Feature,
Beachwood,P-0635,"Shunned by elite society as a member of the gig economy, a sociopathic dog walker infiltrates an exclusive L.A. community with designs of reaching the top of the neighborhood's social ladder.",Thriller,Unproduced Script,Briggs Watkins & Wes Watkins,0,,Low,,,,,,https://8flix.com/scripts/unproduced/2022-part-1#beachwood,,,,,,,,,,,,Adam,,,On the 2022 Black List — #5 overall.,,,,,,,20,2022,Unproduced,Feature,
Below,P-0636,Fresh out of a spell in prison a man attempts to set his life right by working a mysterious job that requires him to seek out life forms hidden amongst us.,Sci-Fi,Unproduced Script,Geoff Tock & Greg Weidman,0,,Low,,,,,,https://8flix.com/scripts/unproduced/2022-part-1#below,,,,,,,,,,,,Adam,,,On the 2022 Black List.,,,,,,,6,2022,Unproduced,Feature,
Better Luck Next Time,P-0637,"Two best friends run a successful underground service taking womens' toxic exes on humiliating dates, but their friendship is put to the ultimate test when an old mark plots his revenge.",Comedy,Unproduced Script,Kristen Tepper,0,,Low,,,,,,https://8flix.com/scripts/unproduced/2022-part-1#better-luck-next-time,,,,,,,,,,,,Adam,,,On the 2022 Black List.,,,,,,,8,2022,Unproduced,Feature,
Black Dogs,P-0638,"In 1973, Led Zeppelin was robbed of nearly a quarter million dollars in cash while playing a series of concerts in New York City. The case was never solved. We follow four young friends from the streets of Baltimore as they attempt to pull off what is possibly the most brazen heist in Rock & Roll history.",Thriller,Unproduced Script,Kieran Turner,0,,Low,,,,,,https://8flix.com/scripts/unproduced/2022-part-1#black-dogs,,,,,,,,,,,,Adam,,,On the 2022 Black List. Based on the novel by Jason Buhrmester.,,,,,,,6,2022,Unproduced,Feature,
Black Kite,P-0639,"After a devastating wildfire wipes out a small California town, a teenage girl is missing and presumed dead. A year later, an obsessive mother and cynical arson investigator begin to suspect that she's still alive...and in the clutches of a predator.",Thriller,Unproduced Script,Dan Bulla,0,,Low,,,,,,https://8flix.com/scripts/unproduced/2022-part-1#black-kite,,,,,,,,,,,,Adam,,,"On the 2022 Black List. | Also on ScriptShadow — Carson Reeves' 'My Top 25' (all-time; ~#25, as of Jul 2026).",,,,,,,6,2022,Unproduced,Feature,
The Boy Houdini,P-0640,"New York, 1889. When young street urchin and aspiring magician Harry Houdini discovers a mysterious puzzle-box, he must use his talent for illusion and escape to unlock the box's powerful secrets and keep it from the hands of a vengeful occult sorcerer hot on his tail.",Fantasy,Unproduced Script,Matthew Tennant,0,,Low,,,,,,https://8flix.com/scripts/unproduced/2022-part-1#boy-houdini-the,,,,,,,,,,,,Adam,,,On the 2022 Black List.,,,,,,,12,2022,Unproduced,Feature,
Break Point,P-0641,"Courted by colleges and sponsors alike, a burnt-out tennis prodigy fights to maintain dominance against her Academy rival as she hurtles toward the existential decision of turning Pro–a choice that will force her to double down on her dream or walk away from the future she's fought for.",Sports,Unproduced Script,Zachary Joel Johnson,0,,Low,,,,,,https://8flix.com/scripts/unproduced/2022-part-1#break-point,,,,,,,,,,,,Adam,,,On the 2022 Black List.,,,,,,,7,2022,Unproduced,Feature,
Caravan,P-0642,"During the Tang Dynasty, a young Persian woman joins a Silk Road caravan to solve the mystery of her father's disappearance, but must fight for survival when her fellow travelers realize there is a shapeshifting demon hiding in their midst.",Horror,Unproduced Script,Lindsay Michel,0,,Low,,,,,,https://8flix.com/scripts/unproduced/2022-part-2#caravan,,,,,,,,,,,,Adam,,,On the 2022 Black List.,,,,,,,7,2022,Unproduced,Feature,
Chatter,P-0643,"Stranded in a small Cajun town, a young mother battling a painkiller relapse must fight to save her daughter from a demonic Tooth Fairy.",Horror,Unproduced Script,Chris Grillot,0,,Low,,,,,,https://8flix.com/scripts/unproduced/2022-part-2#chatter,,,,,,,,,,,,Adam,,,On the 2022 Black List.,,,,,,,6,2022,Unproduced,Feature,
Cheat Day,P-0644,"When a young woman in a decade-long heterosexual relationship realizes she needs to explore her bisexuality, she and her boyfriend institute a ""Cheat Day"": 24 hours in which they can do whatever–and whomever–before deciding whether to get engaged or break up.",Comedy,Unproduced Script,Emma Dudley,0,,Low,,,,,,https://8flix.com/scripts/unproduced/2022-part-2#cheat-day,,,,,,,,,,,,Adam,,,On the 2022 Black List.,,,,,,,10,2022,Unproduced,Feature,
Clementine,P-0645,"Set in real time, a Colombian mother barely escapes a pawn shop shootout and goes on the run from her violent ex-husband, a terrifying mob boss, and a bloodthirsty hitwoman sent to collect an overdue debt, all while trying to keep her diabetic daughter safe.",Thriller,Unproduced Script,David L. Williams,0,,Low,,,,,,https://8flix.com/scripts/unproduced/2022-part-2#clementine,,,,,,,,,,,,Adam,,,"On the 2022 Black List. | Also on ScriptShadow — Carson Reeves' 'My Top 25' (all-time; ~#6, as of Jul 2026).",,,,,,,12,2022,Unproduced,Feature,
