Title,Project ID,Logline,Genre,Lane,Creator/Author/Director,Priority Score,Subgenre/Tags,Urgency Label,Discovery Stage,Country/Language,Platform/Source,Why It Matters,Signal/Proof,Source Link,Rights Status,Rights Holder,Contact/Rep,Adaptation Format,Comps,Heat Score,Concept Score,Adaptability Score,Rights Opportunity Score,Studio Fit Score,Next Action Status,Owner,Next Step,Last Updated,Notes,Project Cover,Search Keywords,Original Release / Publication Date,My Picks,Action Items,Country,Votes,Year Written,Script Status,Format,Script PDF
Katalepsis,P-0236,"A mentally fragile university student who sees impossible things is pulled into a hidden world of cosmic horror and eldritch mathematics, anchored only by a slow-burn queer romance.",Psychological Horror,Self-Published / Web Fiction,Hazel Young (HY),18,,Strong,,English (UK),,,,https://katalepsis.net/,,,,Feature or limited series,,2,4,3,5,4,,,,2019-05-01,,,,,,,,,,,,
Carousel (Will Wight-style horror serial),P-0237,"Ordinary people are trapped in a malevolent town where classic horror-movie scenarios play out for real, forcing them to exploit genre tropes to survive being cast as the victims.",Horror Comedy,Self-Published / Web Fiction,Blaise Corvin / serialized (verify author),21,,Strong,,English (US),,,,https://www.royalroad.com/fiction/59849/carousel,,,,Feature or series,,3,5,4,4,5,,,,2022-01-01,,,,,,,,,,,,
School Bus Graveyard,P-0238,"After a school bus accident, a group of teens is haunted by vengeful spirits from a shadow dimension, forcing former friends and enemies to survive together.",Teen Supernatural Horror,Self-Published / Web Fiction,Red (lilredbeany),13,,Low,,English (US),,,"135M+ views; NOTE: now being adapted by WEBTOON as an animated/video-episode series (IMDb TV mini series 2026) — already in adaptation, lowers rights availability.",https://www.webtoons.com/en/thriller/school-bus-graveyard/list?title_no=2705,,,,"Graphic novel,Feature or series,YA horror",,2,4,4,1,2,,,,2021-07-20,,,,,,,,,,,,
Down to Earth (webtoon),P-0239,"A charming romance between an ordinary young man and a mysterious woman from another planet, blending fish-out-of-water comedy with sci-fi warmth.",Sci-Fi Comedy / Weird Romance,Self-Published / Web Fiction,Pookie Senpai,15,,Track,,English (US),,,,https://www.webtoons.com/en/romance/down-to-earth/list?title_no=1817,,,,"Graphic novel,Feature",,3,3,3,4,2,,,,2016-06-01,,,,,,,,,,,,
Everything Is Fine (webtoon),P-0240,A seemingly perfect suburban couple lives in an eerily pastel neighborhood where everyone wears smiling masks — until cracks reveal a sinister controlled reality.,Psychological Horror / Social Horror,Self-Published / Web Fiction,Mike Birchall,23,,Urgent,,English (UK),,,,https://www.webtoons.com/en/horror/everything-is-fine/list?title_no=2578,,,,"Graphic novel,Feature or limited series",,4,5,5,4,5,,,,2021-04-19,,,,,,,,,,,,
Suitor Armor,P-0241,A palace maid falls for a seemingly sentient suit of enchanted armor in a medieval-fantasy court romance full of intrigue and forbidden feeling.,Romantic Drama,Self-Published / Web Fiction,Purpah,15,,Track,,English (US),,,,https://www.webtoons.com/en/fantasy/suitor-armor/list?title_no=2159,,,,"Graphic novel,Feature or series",,3,3,3,4,2,,,,2019-11-01,,,,,,,,,,,,
Mother of Learning,P-0242,A pragmatic young mage is trapped in a one-month time loop and must master magic and unravel a deadly conspiracy before the reset — a Groundhog-Day-meets-magic thriller.,Fantasy Thriller,Self-Published / Web Fiction,Domagoj Kurmaic (nobody103),19,,Strong,,English (US),,,,https://www.royalroad.com/fiction/21220/mother-of-learning,,,,Feature or limited series,,4,5,3,4,3,,,,2011-08-01,,,,,,,,,,,,
Muted (webtoon),P-0243,"A young witch bound to a possessive demon navigates dark romance, family secrets and body-horror magic in a moody supernatural drama.",Body Horror / Dark Romance,Self-Published / Web Fiction,Miranda Mundt,19,,Strong,,English (US),,,,https://www.webtoons.com/en/mystery/muted/list?title_no=1566,,,,"Graphic novel,Feature or series",,3,4,4,4,4,,,,2019-01-01,,,,,,,,,,,,
The Wandering Inn,P-0244,"A stranded young woman survives in a lethal fantasy world by running an inn, building a sprawling ensemble saga of survival, action and unlikely community.",Fantasy,Self-Published / Web Fiction,pirateaba,13,,Low,,English (US),,,,https://wanderinginn.com/,,,,series,,3,3,2,3,2,,,,2016-07-27,,,,,,,,,,,,
Age Matters,P-0245,"A workplace rom-com in which a capable young woman unknowingly starts a will-they-won't-they with a wealthy, awkward CEO — glossy adult romantic comedy.",Romantic Comedy,Self-Published / Web Fiction,Enjelicious,15,,Track,,English (US),,,,https://www.webtoons.com/en/romance/age-matters/list?title_no=1364,,,,"Graphic novel,Feature",,3,3,4,3,2,,,,2018-01-01,,,,,,,,,,,,
Super Secret (webtoon),P-0246,A human girl and her childhood friend — secretly a supernatural creature — navigate a comedic paranormal romance where monster society hides in plain sight.,Supernatural Thriller,Self-Published / Web Fiction,eon,17,,Track,,English (US),,,,https://www.webtoons.com/en/romance/super-secret/list?title_no=666,,,,"Graphic novel,Feature or series",,3,3,4,4,3,,,,2016-01-01,,,,,,,,,,,,
Delve,P-0247,"In a world governed by a literal game-like system, a lone survivor must strategize and fight through deadly dungeons — a lean, high-adrenaline action-survival serial.",Action Thriller / Survival Action,Self-Published / Web Fiction,SenescentSoul,15,,Track,,English (US),,,,https://www.royalroad.com/fiction/25225/delve,,,,Feature or series,,3,3,2,4,3,,,,2018-04-01,,,,,,,,,,,,
Purple Hyacinth,P-0248,A lie-detecting police officer reluctantly allies with the city's most notorious masked assassin to bring down the criminal organization that murdered her family.,Mystery Thriller,Self-Published / Web Fiction,Ephemerys & Sophism,20,,Strong,,English (US),,,,https://www.webtoons.com/en/mystery/purple-hyacinth/list?title_no=1621,,,,"Graphic novel,Feature or series",,4,5,4,3,4,,,,2019-01-01,,,,,,,,,,,,
#Killstagram,P-0249,"A young woman's viral selfie attracts a masked serial killer who begins stalking her through social media, turning her online life into a survival nightmare.",Comedy Horror / Social Media Thriller,Self-Published / Web Fiction,Ryoung,23,,Urgent,,English (US),,,,https://www.webtoons.com/en/thriller/killstagram/list?title_no=1971,,,,"Graphic novel,Feature,Social media thriller",,4,5,5,4,5,,,,2020-01-01,,,,,,,,,,,,
Pie Game (The 8 Show),P-0250,"Strangers are trapped in a deadly game of survival where a single wrong choice means death, forcing brutal psychological gamesmanship among the players.",Contained Thriller / Psychological Horror,Self-Published / Web Fiction,BAE jin soo,11,,Low,,English (US),,,"ALREADY ADAPTED — Pie Game (sequel to Money Game) is the basis for Netflix's 'The 8 Show' (2024, Ryu Jun-yeol). NOT an available/un-optioned candidate; keep for reference/benchmark only.",https://www.webtoons.com/en/thriller/pie-game-the-8-show/list?title_no=4189,,,,"Graphic novel,Feature or limited series",,1,4,4,1,1,,,,2020-01-01,,,,,,,,,,,,
An Uncomfortable Truth,P-0251,"A seemingly gentle high schooler hides the mind of an obsessive killer, held back only by his devotion to his brother — until fate pushes him toward madness.",Psychological Thriller,Self-Published / Web Fiction,EErun,19,,Strong,,Korean (English translation available),,,,https://www.lezhinus.com/en/comic/uncomfortable_truth,,,,"Graphic novel,Feature",,3,4,4,4,4,,,,2016-11-25,,,,,,,,,,,,
I Love Yoo,P-0252,"A guarded young woman with a traumatic past gets entangled with two wealthy stepbrothers, unraveling family secrets in a slow-burn drama-mystery.",Drama/Thriller,Self-Published / Web Fiction,Quimchee,15,,Track,,English (US),,,,https://www.webtoons.com/en/drama/i-love-yoo/list?title_no=986,,,,"Graphic novel,Feature or series",,3,3,3,4,2,,,,2017-07-01,,,,,,,,,,,,
Of What Remains,P-0253,"Fleeing an abusive relationship, a woman returns to her rural hometown to rebuild — only to uncover buried secrets and a cycle of violence she can't escape.",Rural Thriller / Psychological Horror,Self-Published / Web Fiction,Sillvi Studios,18,,Strong,,English (US),,,,https://www.webtoons.com/en/thriller/of-what-remains/list?title_no=2720,,,,"Graphic novel,Feature",,2,4,4,4,4,,,,2021-11-01,,,,,,,,,,,,
Twig,P-0254,"In an alternate Victorian world of bioengineering, a squad of lab-made child operatives use manipulation and intellect as weapons in a chilling conspiracy thriller.",Sci-Fi Thriller,Self-Published / Web Fiction,Wildbow (John C. McCrae),17,,Track,,English (US),,,,https://twigserial.wordpress.com/,,,,Feature or limited series,,3,4,3,4,3,,,,2015-01-01,,,,,,,,,,,,
The Gwichon Village Mystery,P-0255,"A man visits his late grandmother's mysteriously well-kept rural home, where strange rites, vanishing neighbors and a string of deaths reveal a village-wide secret.",Folk Horror / Creature Thriller,Self-Published / Web Fiction,"YELLOW_SHEEP (Hwang Yang), art by Daehan Lee",19,,Strong,,Korean (English translation available),,,,https://www.webtoons.com/en/thriller/the-gwichon-village-mystery/list?title_no=6667,,,,"Graphic novel,Feature or limited series",,3,4,4,4,4,,,,2024-03-10,,,,,,,,,,,,
"Wait, Your Car?",P-0256,The friendship of four young women is tested when one insists her car is literally trying to kill her — a supernatural comedy that plays as a sly allegory for believing a friend in crisis.,Horror Comedy,Short Film / Filmmaker,Reece Feldman,20,,Strong,,English (US),,,15-min supernatural comedy short (~34K views in 11 days); writer/director Reece Feldman has a large TikTok following (guywithamoviecamera); cast includes Ruby Cruz and Whitney Peak.,https://www.youtube.com/watch?v=8azn-qKbAAU,,,,"Short-to-feature,Feature,Writer/director",,4,4,4,4,4,,,,,,,,,checked,Emailed 7/6/26,,,,,,
Unpaid Interns,P-0257,Sketch comedy group.,Comedy,Comedy People / Creator,Unpaid Interns,0,,Low,,,,Would be curious to know what a genre movie with their sensibility would be.,,Instagram / TikTok,,,,,,,,,,,,Adam,,,Role: Creator (sketch comedy group),,,,,Emailed 5/20. TBD MTG in July.,,,,,,
Adam Somang Karlson,P-0258,Created a webcomic called The Public Domain where public-domain characters fight to the death; also has a script called 8 Limbs about Muay Thai fighters fighting aliens.,Horror Comedy,Comedy People / Creator,Adam Somang Karlson,0,,Low,,,,Would be interested in learning more about both scripts; The Public Domain could be a good short.,,Instagram,,,,,,,,,,,,Adam,,,Role: Writer,,,,,,,,,,,
Walker Ward,P-0259,"Following his pivot from finance, Ward gained a cult following for deadpan character work and relatable corporate / country-club humor. Hosts a digital series called Pedicab Connections (produced by Sharp Entertainment), acting as a mobile matchmaker on the streets of NYC.",Comedy,Comedy People / Creator,Walker Ward,0,,Low,,,,Would be curious to see a short form in the world of finance or elite society — maybe a brother-president gets kidnapped and he needs to pretend to be him so the world doesn't collapse.,,Instagram / TikTok,,,,,,,,,,,,Adam,,,Role: Creator,,,,,"Emailed 6/26. Met with his rep Fran — Walker is busy making a show but referred another client, Sam Swank; sent pilot 'Big Alcohol' (possible feature), liked but didn't love it.",,,,,,
Sam Swank,P-0260,Creator referred by Walker Ward. Has a script called 'Big Alcohol' he's pitching.,Comedy,Comedy People / Creator,Sam Swank,0,,Low,,,,Didn't love 'Big Alcohol' but his videos are good; the one based on a son and father-in-law could be funny.,,TikTok,,,,,,,,,,,,Adam,,,Role: Creator (referred by Walker Ward),,,,,,,,,,,
RDCworld1,P-0261,"YouTube comedy channel making skits, vlogs, short films and more with a large, engaged fanbase.",Comedy,Comedy People / Creator,RDCworld1,0,,Low,,,,,,YouTube,,,,,,,,,,,,Adam,,,Role: Creator,,,,,Emailed 6/25.,,,,,,
Hughhocknoll,P-0262,Creator making comedy and action content from shorts to full feature films; does his own stunts. Invites collaboration from concept to premiere.,Action Comedy,Comedy People / Creator,Hughhocknoll,0,,Low,,,,"Specialized in comedy and action, does stunts. Could be good to pair with the Mayhem Bros.",,YouTube / Instagram,,,,,,,,,,,,Adam,,,Role: Creator,,,,checked,IG DM 6/25 / Email Rep 6/30.,,,,,,
Sahib Singh,P-0263,,Comedy,Comedy People / Creator,Sahib Singh,0,,Low,,,,,,TikTok / YouTube,,,,,,,,,,,,Adam,,,Role: Creator,,,,,,,,,,,
Sienna Hubert-Ross,P-0264,,Comedy,Comedy People / Creator,Sienna Hubert-Ross,0,,Low,,,,,,TikTok / Instagram,,,,,,,,,,,,Adam,,,Role: Creator,,,,,Emailed 6/26.,,,,,,
Legit Pat,P-0265,,Comedy,Comedy People / Creator,Legit Pat,0,,Low,,,,,,Instagram,,,,,,,,,,,,Adam,,,Role: Creator,,,,checked,Emailed 6/6/26,,,,,,
Dan Carney,P-0266,,Comedy,Comedy People / Creator,Dan Carney,0,,Low,,,,,,Instagram / TikTok,,,,,,,,,,,,Adam,,,Role: Creator,,,,,,,,,,,
Nate Meeker,P-0267,,Comedy,Comedy People / Creator,Nate Meeker,0,,Low,,,,,,Instagram,,,,,,,,,,,,Adam,,,Role: Creator,,,,,,,,,,,
Grant Beans,P-0268,,Comedy,Comedy People / Creator,Grant Beans,0,,Low,,,,,,TikTok / Instagram,,,,,,,,,,,,Adam,,,Role: Creator,,,,checked,"Talked with manager, waiting on General.",,,,,,
5555 Leah,P-0269,,Comedy,Comedy People / Creator,5555 Leah,0,,Low,,,,,,Instagram / TikTok,,,,,,,,,,,,Adam,,,Role: Creator,,,,,,,,,,,
Madison Humphrey,P-0270,,Comedy,Comedy People / Creator,Madison Humphrey,0,,Low,,,,,,TikTok / Instagram,,,,,,,,,,,,Adam,,,Role: Creator,,,,,,,,,,,
Michael Kandel,P-0271,Made a 'The Pitt' video game that went viral.,Comedy,Comedy People / Creator,Michael Kandel,0,,Low,,,,,,Twitter / Instagram,,,,,,,,,,,,Adam,,,Role: Creator,,,,,,,,,,,
Chris & Jack,P-0272,"Chris W. Smith and Jack De Sena release comedic sketches of all kinds — sci-fi, heists, animation, movie tropes, absurdist bits — with friendship at the core.",Comedy,Comedy People / Creator,Chris W. Smith & Jack De Sena,0,,Low,,,,,,YouTube,,,,,,,,,,,,Adam,,,Role: Creator (duo),,,,,,,,,,,
Syd & Olivia,P-0273,"Comedy duo who write, produce, direct, edit and star in original sketch videos — fast-paced, joke-heavy dialogue subverting gender stereotypes with absurdist humor. Currently developing a live-action comedy with 20th Century Studios for Hulu (Megan Ganz' Megawatt Productions). Their short 'In Jeff We Trust' premiered at Tribeca 2025. Credits: The Paloni Show! (Hulu), work for Adam McKay's Yellowdot, SMOSH; podcast 'Syd & Olivia Talk S**T' (7EQUIS).",Comedy,Comedy People / Creator,Syd & Olivia,0,,Low,,,,,,TikTok,,,,,,,,,,,,Adam,,,Role: Creator (duo),,,,,Made a short called In Jeff We Trust (Tribeca 2025).,,,,,,
Copycat,P-0274,"A washed-up art instructor becomes obsessed with a serial killer who stages victims as if murdered by their own doubles — and the deeper he investigates, the more the killings implicate him.",Psychological Thriller,Self-Published / Web Fiction,Carnby Kim & Youngchan Hwang,21,,Strong,,Korea (WEBTOON),,"From the Sweet Home / Bastard team (Carnby Kim), whose work has a proven Netflix adaptation track record. Grounded serial-killer horror with a high-concept hook — squarely Hammer's lane. Debuted Apr 2026; this team's IP gets optioned fast, so move early.",,https://www.webtoons.com/en/thriller/copycat/list?title_no=9857,,,,,,4,5,5,2,5,,Adam,,2026-04-14,,,,,,,,,,,,
Vincent the Great,P-0275,"An excommunicated priest hunts the demons picking off the world's exorcists, aided by a nun, a sheriff, and a child who bleeds rose petals and kills anything that bites her.",Supernatural Horror,Self-Published / Web Fiction,pilwon (writer) & houjae (art),20,,Strong,,USA / English (WEBTOON),,"""Constantine meets Hellsing"" gothic-Americana exorcism horror — a rare US-set WEBTOON with strong feature/limited-series bones and (as a brand-new launch) likely available rights.",,https://www.webtoons.com/en/supernatural/vincent-the-great/list?title_no=9244,,,,,,3,4,4,4,5,,Adam,,2025-12-01,,,,,,,,,,,,
Destined Killer,P-0276,A vigilante serial killer who can see how many people each stranger is fated to murder meets a woman who sees how long anyone has left to live — and her numbers start to change.,Supernatural Thriller,Self-Published / Web Fiction,GK & BaBam,21,,Strong,,Korea (WEBTOON),,Twist-driven serial-killer premise with a clean two-hander engine and a built-in moral hook. Contained and castable — a natural film or limited series.,,https://www.webtoons.com/en/thriller/destined-killer/list?title_no=8033,,,,,,3,5,4,4,5,,Adam,,2025-08-01,,,,,,,,,,,,
The Tale of the Skeleton Messenger,P-0277,"Cursed with immortality by the dying Demon Lord, a warrior withers into an undying skeleton and returns centuries later as the herald of a corrupt empire's reckoning.",Fantasy,Self-Published / Web Fiction,kain_y & SORAGAE,18,,Strong,,Korea (WEBTOON),,"Bleak, Frieren-adjacent immortality fable with a striking visual identity; one of the most-talked-about new manhwa of early 2026.",,https://www.webtoons.com/en/action/the-tale-of-the-skeleton-messenger/list?title_no=9470,,,,,,4,4,3,3,4,,Adam,,2026-01-14,,,,,,,,,,,,
The Frostbound Warrior,P-0278,"Goryeo's greatest swordsman wakes after centuries frozen in ice, bent on revenge — then becomes bodyguard-manager to his lost love's descendant, a rising actress.",Action Thriller,Self-Published / Web Fiction,toy & Seonhaenghaejusipsio (art: Choi Yong Jun),17,,Track,,Korea (WEBTOON),,Inverts the regression trope — a man out of time thrust into modern showbiz. Fish-out-of-water hook with a built-in contemporary setting makes it unusually adaptable for the genre.,,https://www.webtoons.com/en/action/the-frostbound-warrior/list?title_no=8164,,,,,,3,4,4,3,3,,Adam,,2025-10-01,,,,,,,,,,,,
Return of the Demonic Instructor,P-0279,"A powerless martial artist, brainwashed into commanding a demon army during an alien-demon invasion, regresses ten years to stop the apocalypse before it begins.",Sci-Fi,Self-Published / Web Fiction,MIDNIGHT STUDIO & FISH,13,,Low,,Korea (WEBTOON),,"Murim-meets-sci-fi-apocalypse regression; genre-blending hook, though dense mythology and heavy world-building lower feature adaptability.",,https://www.webtoons.com/en/action/return-of-the-demonic-instructor/list?title_no=9262,,,,,,3,3,2,3,2,,Adam,,2026-01-01,,,,,,,,,,,,
Ghost Dating Simulation,P-0280,"A streamer is trapped inside a dating sim made real, where he must romance dangerous ghosts to survive — every wrong choice is lethal, and he has a limited number of lives.",Horror Comedy,Self-Published / Web Fiction,DONG9,21,,Strong,,Korea (WEBTOON),,"High-concept horror-comedy with a killer logline that whiplashes between terrifying and funny — a natural genre-film pitch, and rights are likely open.",,https://www.webtoons.com/en/romance/ghost-dating-simulation/list?title_no=8381,,,,,,4,5,4,4,4,,Adam,,2025-10-15,,,,,,,,,,,,
Zodiac Girls,P-0281,A young man becomes referee for a supernatural rematch of the Chinese zodiac race when the people around him start becoming vessels for the twelve zodiac spirits.,Fantasy,Self-Published / Web Fiction,JiJi & MAJOR,13,,Low,,Korea (WEBTOON),,"""Fruits Basket via the zodiac race"" — a clean mythic hook with ensemble and animation potential.",,https://www.webtoons.com/en/action/zodiac-girls/list?title_no=9116,,,,,,3,3,3,3,1,,Adam,,2025-12-15,,,,,,,,,,,,
Superfish,P-0282,"A skeptic accidentally bonds to a witch's magical core on a night out, becoming a magnet for supernatural predators — with the reluctant witch forced to protect him.",Fantasy,Self-Published / Web Fiction,Peglo,16,,Track,,English (WEBTOON),,"Forced-proximity urban fantasy from an established creator (To the Stars and Back). Buzzy 2025 launch with a strong, stylish voice.",,https://www.webtoons.com/en/supernatural/superfish/list?title_no=7777,,,,,,3,4,3,3,3,,Adam,,2025-11-01,,,,,,,,,,,,
The Bathroom Ghost,P-0283,"A ghost girl in training haunts a shopping-mall bathroom and keeps failing to scare anyone, navigating an afterlife of supernatural bureaucracy.",Horror Comedy,Self-Published / Web Fiction,Volpe,13,,Low,,English (WEBTOON),,Charming Canvas-to-Original success; light supernatural-comedy IP with animation appeal and open rights.,,https://www.webtoons.com/en/comedy/the-bathroom-ghost/list?title_no=7595,,,,,,2,3,2,4,2,,Adam,,2025-05-01,,,,,,,,,,,,
Miss Pendleton,P-0284,"A celebrated Regency matchmaker, oblivious to romance when she's the target, is hired to find a match for a brooding recluse who is quietly falling for her instead.",Romantic Comedy,Self-Published / Web Fiction,Yu Hyemin & kkomak,12,,Low,,Korea (WEBTOON),,"""Bridgerton meets Pride & Prejudice"" with no fantasy elements — an easy period-romance adaptation comp.",,https://www.webtoons.com/en/historical/miss-pendleton/list?title_no=7847,,,,,,3,2,3,3,1,,Adam,,2025-08-01,,,,,,,,,,,,
My Bias Gets on the Last Train,P-0285,A fan keeps meeting a mysterious woman on the late-night train who shares his love of an anonymous indie band — not knowing she's secretly its lead singer.,Romantic Drama,Self-Published / Web Fiction,JIXKSEE,13,,Low,,Korea (WEBTOON),,Idol / fan-culture romance (Oshi no Ko adjacent) with breakout art and 26M+ views; a strong K-drama comp.,,https://www.webtoons.com/en/romance/my-bias-gets-on-the-last-train/list?title_no=7857,,,,,,3,3,3,3,1,,Adam,,2025-04-01,,,,,,,,,,,,
There's No Such Thing as a Bad Lady,P-0286,"A slum-raised mage is hired to tutor a group of noblewomen branded ""bad ladies"" by society, in a world where magic is status and rumor is a weapon.",Fantasy,Self-Published / Web Fiction,Korita; adapted by Shin Heebin; art by TEAM PINKSHARK,12,,Low,,Korea (WEBTOON),,Class-and-rumor social fantasy with sharp dialogue; a quiet standout among 2026 romance-fantasy debuts.,,https://www.webtoons.com/en/fantasy/theres-no-such-thing-as-a-bad-lady/list?title_no=9716,,,,,,2,3,3,3,1,,Adam,,2026-02-01,,,,,,,,,,,,
I Will Become the Villain's Poison Taster,P-0287,"Reincarnated as a death-row villainess who is immune to poison and can identify any toxin by taste, a woman talks her way into the villains' service as their poison taster to rewrite her fate.",Fantasy,Self-Published / Web Fiction,PilYoo (art) & jagalchikon / Nemoraming,11,,Low,,Korea (WEBTOON),,"""Apothecary Diaries""-adjacent otome-isekai with a fresh detection hook.",,https://www.webtoons.com/en/romance/i-will-become-the-villains-poison-taster/list?title_no=8570,,,,,,2,3,2,3,1,,Adam,,2025-09-01,,,,,,,,,,,,
Fae Trapped,P-0288,A fae wrongly branded a traitor and exiled from her homeland accidentally swaps bodies with a tortured human sculptor when a spell to return home goes wrong.,Fantasy,Self-Published / Web Fiction,instantmiso,13,,Low,,English (WEBTOON),,"From instantmiso (Siren's Lament) — proven fandom, lush art, and a body-swap romance hook.",,https://www.webtoons.com/en/romance/fae-trapped/list?title_no=8904,,,,,,3,3,3,3,1,,Adam,,2025-10-01,,,,,,,,,,,,
Curveball and Splitter,P-0289,A burned-out office worker who jokes about hiring a hitman for his bosses is upended by the return of a former high-school baseball teammate nursing a long-held grudge.,Romantic Drama,Self-Published / Web Fiction,Yakguk,11,,Low,,Korea (Manta),,Acclaimed BL sports drama; a character study of addiction and self-destruction. Manta exclusive.,,https://manta.net/en/series/curveball-and-splitter?seriesId=3110,,,,,,2,3,2,3,1,,Adam,,2025-06-01,,,,,,,,,,,,
Dark Guardian,P-0290,"Lucifer calls off a wager with God over an orphan boy's soul when the boy sees through his deception, and the two agree to meet once a year until the day his soul is claimed.",Romantic Drama,Self-Published / Web Fiction,SS,12,,Low,,Korea (Manta),,"Tight 10-chapter theological BL about salvation and eternity; a contained, striking premise.",,https://manta.net/en/series/dark-guardian?seriesId=3106,,,,,,2,3,2,3,2,,Adam,,2025-09-01,,,,,,,,,,,,
The Keluarga Cable Ship Company,P-0291,"A father and son who can't see eye to eye end up on the same cable-repair ship maintaining the internet's undersea infrastructure, their diverging stories told in three parallel scrolling columns.",Family Drama,Self-Published / Web Fiction,Mereida Fajardo,12,,Low,,UK / English (Self-Published),,Formally daring family drama told in three parallel scrolling columns; a distinctive indie voice with wide-open rights.,,https://www.mereida.co.uk/the-keluarga-cable-ship-company,,,,,,1,4,2,4,1,,Adam,,2025-07-01,,,,,,,,,,,,
trAPPed,P-0292,"An Indian woman is ensnared by a ""digital arrest"" phone scam — con artists posing as police — in a horror story that weaponizes the infinite scroll and the cold glow of the screen.",Horror Drama / Social Thriller,Self-Published / Web Fiction,"Suparna Sharma, Natalie Obiko Pearson & Anand RK",20,,Strong,,India / English (Bloomberg),,"Ripped-from-reality tech-horror published by Bloomberg; timely, contained, and cinematic — a real-world horror premise with festival / limited-series potential.",,https://www.bloomberg.com/graphics/2025-india-digital-arrest-by-phone-graphic-novel/,,,,,,3,5,4,4,4,,Adam,,2025-05-01,,,,,,,,,,,,
Tiger Girls,P-0293,"In a society where girls born in the Year of the Tiger are killed as bad omens, the survivors hide on remote islands and train for the mainland's next assault.",Action Drama / Survival Thriller,Self-Published / Web Fiction,Felicia Low-Jimenez & Claire Low,17,,Track,,Singapore / English (Difference Engine),,Singaporean feminist dystopia with a razor-sharp premise and a strong world; a fresh non-Korean voice with rights wide open.,,https://tigergirlscomic.differenceengine.sg/,,,,,,2,4,4,4,3,,Adam,,2025-04-01,,,,,,,,,,,,
