Title,Project ID,Logline,Genre,Lane,Creator/Author/Director,Priority Score,Subgenre/Tags,Urgency Label,Discovery Stage,Country/Language,Platform/Source,Why It Matters,Signal/Proof,Source Link,Rights Status,Rights Holder,Contact/Rep,Adaptation Format,Comps,Heat Score,Concept Score,Adaptability Score,Rights Opportunity Score,Studio Fit Score,Next Action Status,Owner,Next Step,Last Updated,Notes,Project Cover,Search Keywords,Original Release / Publication Date,My Picks,Action Items,Country,Votes,Year Written,Script Status,Format,Script PDF
The Door,,"After her daughter vanishes, a grieving mother becomes fixated on a mysterious door that appears inside her home — a door that promises the truth at the cost of her grip on reality.",Psychological Horror,Short Film / Filmmaker,Alexander Seltzer,0,,Low,Bubbling,USA / English,,"Clean, high-concept grief-horror premise that scales naturally to a feature, anchored by a single marketable image (the door). Director has a repeatable track record in the format.",Reported 2M+ YouTube views. Named to Film Shortage's Top 10 Short Films of 2025; first surfaced at Chilliwack Independent Film Festival. Prior short '10:33' made Film Shortage's Top 10 in 2023.,https://filmshortage.com/shorts/the-door/,Creator-owned to verify,,,,"The Babadook, Hereditary (grief-horror); His House (portal/threshold hook)",,,,,,Watch Online / Recent,Adam,Watch on YouTube; confirm rights are unattached; assess whether the premise sustains a feature.,"July 1, 2026",HIGH confidence lead. Find the direct YouTube URL via Film Shortage and confirm no option is in place before outreach.,,"The Door, Alexander Seltzer, grief horror, missing daughter, mysterious door, 2025 short",,,,,,,,,
Skulk,,Woken by the barking of foxes — said to signal a sinister presence — a woman realizes something outside desperately wants to get into her home.,Supernatural Horror / Contained Thriller,Short Film / Filmmaker,Max Ward,0,,Low,Niche Breakout,UK / English,,"Masterclass in economical, single-location dread — exactly the contained-horror model that scales to a profitable feature. Director has ~8 years building craft in the short form.","Named among the Best Short Films of 2025 by Warped Perspective; screened at Celluloid Screams (Sheffield, UK).",https://www.youtube.com/watch?v=Blio4-zVGF8,Creator-owned to verify,,,,"Skinamarink, The Vast of Night (economical single-location horror)",,,,,,Research Availability,Adam,"Locate an online link (festival-only so far — check director's Vimeo/YouTube); if watchable, assess feature scalability.","July 1, 2026",MEDIUM confidence. Online watchability NOT yet confirmed — appears festival-circuit so far. Verify a watch link before treating as actionable.,,"Skulk, Max Ward, folk horror, foxes, contained horror, UK short 2025",,,,,,,,,
Unprompted,,A struggling horror screenwriter turns to AI to help him write — and gets far more than he asked for.,AI Sci-Fi / Tech Thriller,Short Film / Filmmaker,Stephen Packer,0,,Low,Niche Breakout,Australia / English (verify),,"Zeitgeist premise (AI + creativity + horror) that is inherently marketable right now; contained, low-budget-scalable concept.","Directed by Stephen Packer. Tropfest 2026 Finalist (screened as a comedy-thriller cut). Distributed on ALTER, June 2026.",https://www.youtube.com/watch?v=o6VCDRtvfZo,Needs Research,,,,Late Night with the Devil (industry-insider horror); Black Mirror-style tech horror,,,,,,Watch Online / Recent,Adam,Watch on ALTER + Tropfest; confirm same film; verify rights; assess feature scalability of the AI hook.,"July 1, 2026","Solid IN-WINDOW pick (2026) with a real festival credential (Tropfest 2026 Finalist). Before outreach, confirm the ALTER cut and the Tropfest cut are the same film (premises match). Verify rights.",,"Unprompted, ALTER, AI horror, screenwriter, tech horror, 2026 short",,checked,Meeting with director 6/7/26,,,,,,
Rare Medium,,A grieving everyman hires a psychic medium for a straightforward spiritual possession — which is promptly hijacked by a crew of murderous cannibals. Bloodless horror-comedy.,Horror Comedy / Cannibal Comedy,Short Film / Filmmaker,Emily Maya Mills,0,,Low,Niche Breakout,Verify,,"Tonally distinctive bloodless horror-comedy. Director Emily Maya Mills is an established LA comedy creator (USC School of Cinematic Arts) with deep TV/standup credits — a genuine comedy-voice talent lead, not a one-off.","Directed by Emily Maya Mills. Festival run: Dances With Films '24, Edmonton Int'l FF '24, ScreamFest NoLa '24, Newport Beach FF '24, Dam Short '25, Poppy Jasper '25 (WINNER: Best Local Horror). Distributed on ALTER, March 2026.",https://www.youtube.com/watch?v=nXglf3Pa-NM,Needs Research,,,,Bodies Bodies Bodies (bloodless dark comedy-horror); The Menu (tonal),,,,,,Watch Online / 2024 Backup,Adam,Watch; identify director; check rights.,"July 1, 2026","DATE FLAG — festival premiere was 2024, so it predates your 18-month window; the ALTER upload (Mar 2026) is a distribution window, not the film's vintage. Still a strong comedy-talent lead. Verify rights.",,"Rare Medium, Emily Maya Mills, horror comedy, possession, cannibals, ALTER",,,,,,,,,
The Moths Will Eat Them Up,,A woman's simple night train ride home turns into something far more sinister.,Horror/Thriller,Short Film / Filmmaker,Verify on ALTER page,0,,Low,Niche Breakout,Verify,,"Contained, single-setting suspense (a train) — cheap to scale and tension-first, the kind of showcase that proves directorial control.","Released on ALTER, September 2025.",https://www.youtube.com/watch?v=ntlFB_blHBo,Needs Research,,,,"Talk to Me (contained dread); Train to Busan (single-transit horror, tonally)",,,,,,Benchmark Only,Adam,Watch; identify director; check rights.,"July 1, 2026","REMOVE / DOES NOT FIT CRITERIA — this is a 2021 film (Tanya Modini & Luisa Martiri), AACTA-nominated, won Sydney FF's Dendy Award, Oscar contender, already distributed by Magnet Film (Berlin). Too old, overexposed, and rights are held. The recent ALTER upload date was misleading. Safe to delete.",,"The Moths Will Eat Them Up, ALTER, train horror, contained thriller, 2025 short",,,,,,,,,
Rain,,"During a tense family Christmas as ecological collapse looms outside, a pregnant daughter must choose between suffocating familial obligation and her own safety when a mysterious orange light appears.",Psychological Horror / Domestic Thriller,Short Film / Filmmaker,Imogen McCluskey,0,,Low,Niche Breakout,Australia / English,,Blends elevated genre with topical climate anxiety and a strong female POV — the commercial 'elevated horror' lane (A24/Neon adjacent). Feature-scalable dread with awards-friendly themes.,"Named to Film Shortage's Top 10 Short Films of 2025, with a published review + director interview.",https://filmshortage.com/shorts/rain/,Creator-owned to verify,,,,"Hereditary, Take Shelter (dread + family + looming catastrophe)",,,,,,Watch Online / Recent,Adam,Confirm director's full name and watch link via Film Shortage; assess.,"July 1, 2026",MEDIUM confidence. Only director surname captured ('McCluskey') — confirm full name and online watch link.,,"Rain, McCluskey, elevated horror, climate, family, Australia short 2025",,,,,,,,,
Terror by Night,,An astral traveller and a detective risk everything to stop a supernatural threat that hunts victims in their sleep.,Supernatural Thriller,Short Film / Filmmaker,Dean Butler,0,,Low,Niche Breakout,Australia / English,,"Genre-hybrid engine (supernatural + procedural) with a pre-built, expandable world — already a three-film trilogy. Upside: the world is proven. Downside: that also means the IP is more developed and likely more tightly held.","Directed by Dean Butler (Australia). Third installment of the 'Evenfall' short trilogy (Evenfall 2020, A Shadow in the Darkness 2021). Won Best Australian Short (festival). Distributed on ALTER, Dec 2025.",https://www.youtube.com/watch?v=2WYfQd_g0N0,Needs Research,,,,"Insidious (astral projection), Fallen (supernatural procedural)",,,,,,Watch Online / 2024 Backup,Adam,Watch; identify director; assess the world for feature/franchise scale.,"July 1, 2026","DATE + IP FLAG — IMDb lists it as a 2024 short (predates your window); ALTER upload Dec 2025 is a distribution window. As a trilogy capper, the world/IP is already developed and likely more controlled — factor into any rights conversation.",,"Terror by Night, ALTER, astral projection, detective, supernatural thriller, 2025 short",,,,,,,,,
,,,,,,0,,Low,,,,,,,,,,,,,,,,,,,,,,,,,,,,,,,,
Buckshot Roulette,P-0001,A desperate player faces a sinister dealer in a brutal shotgun roulette game where every round turns survival into strategy.,Horror/Thriller,Indie Game,Mike Klubnika,23,"contained,gambling,single location,sadistic game",Urgent,Niche Breakout,English,Steam,"Clean contained horror-thriller engine; easy to imagine as a low-budget, high-tension feature.",Strong Steam visibility and viral streamer/gameplay awareness.,https://store.steampowered.com/app/2835570/Buckshot_Roulette/,Unknown,Mike Klubnika / Critical Reflex to verify,Research publisher/developer contact,Feature,"Saw, Talk to Me, Uncut Gems",5,5,5,3,5,Promising,,Identify rights holder and representation; consider general with creator/publisher.,2026-06-29,,,"indie game, Steam, video game IP, game adaptation, horror game, contained genre, streamer hit, gaming audience, interactive horror, game rights",,,,,,,,,
Mouthwashing,P-0002,"After a catastrophic crash strands a space freighter crew, their injured captain and dwindling supplies turn the ship into a psychological nightmare.",Psychological Horror,Indie Game,Wrong Organ,21,"space horror,guilt,unreliable narrator,crew collapse",Strong,Niche Breakout,English,Steam,Strong narrative-horror world with a contained ensemble setup and memorable title.,Major indie horror conversation and strong Steam user-review signal.,https://store.steampowered.com/app/2475490/Mouthwashing/,Unknown,Wrong Organ / Critical Reflex to verify,Research developer/publisher contact,Feature or limited series,"Event Horizon, Sunshine, The Thing",5,4,4,3,5,Promising,,Play/watch full walkthrough; assess whether rights are available.,2026-06-29,,,"indie game, Steam, video game IP, game adaptation, horror game, contained genre, streamer hit, gaming audience, interactive horror, game rights",,,,,,,,,
Lethal Company,P-0003,Underpaid scavengers are sent into monster-filled industrial ruins to meet impossible corporate quotas.,Horror Comedy,Indie Game,Zeekerss,20,"workplace,monsters,co-op,corporate satire",Strong,Industry Visible,English,Steam,Huge audience signal; premise has obvious horror-comedy series/feature potential.,Large Steam player/review footprint and streamer-driven cultural awareness.,https://store.steampowered.com/app/1966720/Lethal_Company/,Unknown / likely competitive,Zeekerss to verify,Research creator contact/rep,Feature or series,"The Office meets Alien, Cabin in the Woods",5,5,4,2,4,Track / Competitive,,Track representation; consider talent/project approach if not already controlled.,2026-06-29,,,"indie game, Steam, video game IP, game adaptation, horror game, contained genre, streamer hit, gaming audience, interactive horror, game rights",,,,,,,,,
Content Warning,P-0004,A group of clout-chasing friends descends into a monster-filled underworld to film viral videos before the content kills them.,Horror Comedy,Indie Game,Landfall,20,"influencer satire,found footage,monsters,social media",Strong,Niche Breakout,English,Steam,"Modern, social-media-facing horror-comedy premise with an obvious youth angle.",High visibility on Steam and streamer platforms.,https://store.steampowered.com/app/2881650/Content_Warning/,Unknown,Landfall to verify,Research Landfall business contact,Feature,"Bodies Bodies Bodies, Deadstream, Unfriended",4,5,4,3,4,Promising,,Research rights and evaluate full game loop as story engine.,2026-06-29,,,"indie game, Steam, video game IP, game adaptation, horror game, contained genre, streamer hit, gaming audience, interactive horror, game rights",,,,,,,,,
R.E.P.O.,P-0005,A crew repossesses valuable objects from deadly haunted locations where the job itself becomes a monster movie.,Horror Comedy,Indie Game,semiwork,20,"co-op,haunted objects,salvage,chaos",Strong,Bubbling,English,Steam,Commercial horror-comedy engine; could translate as a blue-collar supernatural feature.,Strong Steam user interest and streamer-friendly gameplay.,https://store.steampowered.com/app/3241660/REPO/,Unknown,semiwork to verify,Research developer contact,Feature or series,"Ghostbusters, Evil Dead Rise, Lethal Company",4,4,4,4,4,Promising,,Verify developer contact and growth trajectory.,2026-06-29,,,"indie game, Steam, video game IP, game adaptation, horror game, contained genre, streamer hit, gaming audience, interactive horror, game rights",,,,,,,,,
"No, I'm not a Human",P-0006,"During an apocalyptic crisis, strangers beg for shelter at night, but some may only be pretending to be human.",Paranoid Horror,Indie Game,Trioskaz,22,"home invasion,social deduction,impostors,apocalyptic",Urgent,Bubbling,English,Steam,Extremely clean paranoia premise; ideal for contained thriller/horror adaptation.,Strong premise recognition and festival/demo buzz in indie horror circles.,https://store.steampowered.com/app/3180070/No_Im_not_a_Human/,Unknown,Trioskaz / publisher to verify,Research developer/publisher contact,Feature,"The Thing, Knock at the Cabin, It Comes at Night",3,5,5,4,5,Promising,,Prioritize rights inquiry before it becomes more visible.,2026-06-29,,,"indie game, Steam, video game IP, game adaptation, horror game, contained genre, streamer hit, gaming audience, interactive horror, game rights",,,,,,,,,
The Exit 8,P-0007,A man trapped in an endless underground passage must notice subtle anomalies to escape before the loop consumes him.,Psychological Thriller,Foreign Film / Remake Candidate,Kotake Create / film team to verify,21,"liminal,subway,loop,contained,Japanese",Strong,Industry Visible,Japan / Japanese,Film / Game IP,Extremely clean contained thriller engine with global liminal-space appeal.,Game became visible enough to support a Japanese film adaptation; track remake rights separately.,https://store.steampowered.com/app/2653790/The_Exit_8/,Unknown / likely controlled,Kotake Create / film rights holder to verify,Research Japanese rights/sales company,English-language remake,"Cube, Vivarium, The Platform",4,5,5,2,5,Rights Research,,Identify film sales company and game-rights chain.,2026-06-29,,,"foreign remake, remake candidate, international film, English-language adaptation, global horror, global thriller, foreign film, international box office, non-English film, remake rights",,,,,,,,,
Sleep,P-0008,"A pregnant wife fears her husband’s sleepwalking is becoming something violent, supernatural, or worse.",Domestic Horror Thriller,Foreign Film / Remake Candidate,Jason Yu,21,"marriage,sleep disorder,Korean,contained",Strong,Industry Visible,South Korea / Korean,Foreign film,Contained marital paranoia with clean U.S. remake potential.,Well-reviewed Korean genre film with international festival/trade visibility.,https://www.imdb.com/title/tt8209702/,Unknown / likely represented,Korean producers/sales company to verify,Research sales company,English-language remake,"Rosemary's Baby, The Babadook, The Night House",4,5,5,2,5,Rights Research,,Find sales company; check if English-language rights already sold.,2026-06-29,,,"foreign remake, remake candidate, international film, English-language adaptation, global horror, global thriller, foreign film, international box office, non-English film, remake rights",,,,,,,,,
When Evil Lurks,P-0009,Two brothers discover a demonic infection festering in a rural village and unleash something worse by trying to remove it.,Possession Horror,Foreign Film / Remake Candidate,Demián Rugna,20,"Argentine,rural,infection,demonic,brutal",Strong,Industry Visible,Argentina / Spanish,Foreign film,Fresh possession mythology; strong genre identity and global horror visibility.,Breakout international horror conversation and strong genre-festival visibility.,https://www.imdb.com/title/tt16300962/,Unknown / likely competitive,Producer/sales company to verify,Research sales company,Remake or filmmaker relationship,"Evil Dead, The Wailing, Hereditary",5,4,4,2,5,Track / Competitive,,Check rights status; perhaps prioritize filmmaker relationship over remake.,2026-06-29,,,"foreign remake, remake candidate, international film, English-language adaptation, global horror, global thriller, foreign film, international box office, non-English film, remake rights",,,,,,,,,
The Coffee Table,P-0010,A couple’s argument over an ugly coffee table becomes the beginning of an unthinkable domestic nightmare.,Black Comedy Horror,Foreign Film / Remake Candidate,Caye Casas,19,"Spanish,domestic nightmare,taboo,single-location escalation",Strong,Niche Breakout,Spain / Spanish,Foreign film,"Small, cheap, unforgettable premise; potential as a provocative contained remake.",Strong word-of-mouth among extreme/black-comedy genre audiences.,https://www.imdb.com/title/tt21874760/,Unknown,Spanish producer/sales company to verify,Research sales company,English-language remake,"Force Majeure, Speak No Evil, Mother!",3,5,4,3,4,Rights Research,,Watch internally; decide if tone fits brand appetite.,2026-06-29,,,"foreign remake, remake candidate, international film, English-language adaptation, global horror, global thriller, foreign film, international box office, non-English film, remake rights",,,,,,,,,
Tumbbad,P-0011,A man’s obsession with a cursed ancestral treasure draws him deeper into a mythic bargain with a forgotten god.,Folk Horror Fantasy,Foreign Film / Remake Candidate,Rahi Anil Barve,18,"Indian,mythology,greed,cursed treasure",Strong,Industry Visible,India / Hindi,Foreign film,"Gorgeous folk-horror mythology; remake may be harder, but filmmaker/world signal is valuable.",Cult international reputation and sustained genre awareness.,https://www.imdb.com/title/tt8239946/,Unknown / likely controlled,Producers to verify,Research producer/sales contacts,Remake or inspired-by relationship,"Pan's Labyrinth, The Witch, There Will Be Blood",4,4,3,2,5,Track,,Track rights and filmmaker relationship.,2026-06-29,,,"foreign remake, remake candidate, international film, English-language adaptation, global horror, global thriller, foreign film, international box office, non-English film, remake rights",,,,,,,,,
Exhuma,P-0012,Occult specialists uncover a cursed grave whose secrets threaten to awaken a deeper national horror.,Occult Horror,Foreign Film / Remake Candidate,Jang Jae-hyun,18,"Korean,shamanism,grave,curse,investigation",Strong,Too Obvious,South Korea / Korean,Foreign film,Massive Korean horror signal; useful benchmark even if rights are competitive.,Major Korean box-office breakout and international attention.,https://www.imdb.com/title/tt27802490/,Likely competitive,Showbox/producers to verify,Research sales company,Remake or benchmark,"The Wailing, The Conjuring, The Medium",5,4,3,1,5,Track / Competitive,,Use as benchmark; verify if any English remake rights are open.,2026-06-29,,,"foreign remake, remake candidate, international film, English-language adaptation, global horror, global thriller, foreign film, international box office, non-English film, remake rights",,,,,,,,,
Good Boy,P-0013,A woman’s promising new relationship curdles when she learns her boyfriend lives with a man who behaves like his dog.,Psychological Thriller,Foreign Film / Remake Candidate,Viljar Bøe,20,"Norwegian,dating,kink,dog costume,social horror",Strong,Bubbling,Norway / Norwegian,Foreign film,One-sentence hook; low-budget social thriller with U.S. remake potential.,Genre-circuit awareness and memorable premise.,https://www.imdb.com/title/tt19705884/,Unknown,Producers/sales company to verify,Research sales company,English-language remake,"Fresh, Speak No Evil, The Invitation",3,5,5,3,4,Promising,,Identify sales agent; assess tone and U.S. casting viability.,2026-06-29,,,"foreign remake, remake candidate, international film, English-language adaptation, global horror, global thriller, foreign film, international box office, non-English film, remake rights",,,,,,,,,
The Similars,P-0014,"During a storm, strangers trapped in a bus station begin transforming into the same person.",Sci-Fi Horror Thriller,Foreign Film / Remake Candidate,Isaac Ezban,19,"Mexican,storm,bus station,identity,Twilight Zone",Strong,Buried,Mexico / Spanish,Foreign film,Contained and highly remakeable; older but under-exploited.,Cult genre awareness; clean premise.,https://www.imdb.com/title/tt3949658/,Unknown,Producers/sales company to verify,Research sales company,English-language remake,"The Twilight Zone, Coherence, The Mist",2,5,5,3,4,Research,,Check remake rights availability and whether any prior option exists.,2026-06-29,,,"foreign remake, remake candidate, international film, English-language adaptation, global horror, global thriller, foreign film, international box office, non-English film, remake rights",,,,,,,,,
The Incident,P-0015,Two separate groups are trapped in impossible repeating spaces that stretch ordinary moments into decades.,Sci-Fi Thriller,Foreign Film / Remake Candidate,Isaac Ezban,18,"Mexican,time loop,infinite staircase,existential",Strong,Buried,Mexico / Spanish,Foreign film,Strong sci-fi containment and existential horror; adaptable at modest budget.,Cult genre reputation; under-the-radar compared with U.S. loop thrillers.,https://www.imdb.com/title/tt3528756/,Unknown,Producers/sales company to verify,Research sales company,English-language remake,"Cube, Triangle, Coherence",2,5,4,3,4,Research,,Watch and research rights chain.,2026-06-29,,,"foreign remake, remake candidate, international film, English-language adaptation, global horror, global thriller, foreign film, international box office, non-English film, remake rights",,,,,,,,,
Vita Carnis,P-0018,A faux nature-documentary world where terrifying meat-based organisms have become part of everyday ecology.,Analog Horror,Online Creator / Internet IP,Darian Quilloy / Darian Quilloy to verify,21,"creature,faux documentary,evolutionary horror,worldbuilding",Strong,Niche Breakout,English,YouTube,"Creature/worldbuilding IP that could become anthology, feature, or series.",Strong analog-horror fandom and recognizable monster mythology.,https://en.wikipedia.org/wiki/Vita_Carnis,Creator-owned to verify,Creator to verify,Research creator contact,"Feature,series,or anthology","The X-Files, Annihilation, Local 58",4,4,4,4,5,Research Availability,,Project page added; still replace with direct channel/episode page if found.,2026-06-29,,,,,,,,,,,,
Mystery Flesh Pit National Park,P-0019,"A fake national park built inside a living underground organism becomes the site of corporate disaster, body horror, and American folklore.",Worldbuilding Horror,Online Creator / Internet IP,Trevor Roberts,21,"faux history,body horror,national park,disaster",Strong,Niche Breakout,US / English,Website / social / book,Rich transmedia world; strong pitch-deck/IP potential.,Sustained online fandom and merchandise/book awareness.,https://www.mysteryfleshpitnationalpark.com/,Creator-owned to verify,Trevor Roberts to verify,Research official contact/reps,"Feature,series,or mockumentary","Jurassic Park, Chernobyl, Annihilation",4,5,4,3,5,Promising,,Identify rights status and pitch format.,2026-06-29,,,,,checked,,,,,,,
The Cabin Is Always Hungry,P-0020,"A sinister cabin demands victims, turning shelter into a predatory supernatural trap.",Horror Fantasy,Self-Published / Web Fiction,Royal Road author to verify,18,"cabin,monster,survival,web fiction",Strong,Bubbling,English,Royal Road,Potentially adaptable contained horror engine if rights are creator-owned.,Web-fiction discovery signal; requires confirmation of current ranking/metrics.,https://www.royalroad.com/,Unknown / likely author-owned,Author to verify,Royal Road profile/contact,Feature,"The Ruins, The Ritual, Monster House",2,4,4,4,4,Needs Research,,"Find exact listing, read first chapters, confirm audience metrics.",2026-06-29,,,"self-published book, web fiction, Royal Road, Wattpad, online fiction, book adaptation, emerging author, serialized fiction, web novel",,,,,,,,,
Theo of Golden,P-0021,"A young protagonist navigates a dangerous fantasy world where power, identity, and survival evolve over time.",Fantasy,Self-Published / Web Fiction,Royal Road author to verify,15,"progression fantasy,web fiction,character-led",Track,Niche Breakout,English,Royal Road,Useful as web-fiction signal; may be more TV/animation than feature.,Royal Road visibility; verify current metrics.,https://www.royalroad.com/,Unknown / likely author-owned,Author to verify,Royal Road profile/contact,Series / animation,"Arcane, The Dragon Prince, Shadow and Bone",3,3,3,4,2,Track,,Confirm exact page and whether concept fits studio mandate.,2026-06-29,,,"self-published book, web fiction, Royal Road, Wattpad, online fiction, book adaptation, emerging author, serialized fiction, web novel",,,,,,,,,
I Am Mother,P-0022,A family-centered sci-fi thriller hook to verify in webcomic pipelines.,Thriller / Sci-Fi,Anime / Manga / Graphic Novel,Webtoon creator to verify,13,"webtoon,AI,family,thriller",Low,Bubbling,Various,Webtoon/Tapas watchlist,Placeholder pattern for webtoon lead ingestion; replace with specific title once scraped.,Needs source confirmation.,https://www.webtoons.com/,Unknown,Creator/platform to verify,Platform contact/creator profile,Feature or series,"M3GAN, Black Mirror, Orphan",1,3,3,3,3,Needs Source Verification,,Use Airtable ingestion to replace placeholder with verified webtoon titles.,2026-06-29,,,"anime, manga, graphic novel, webtoon, comic adaptation, animated adaptation, Japanese IP, Korean webtoon, genre IP, emerging comic, emerging manga",,,,,,,,,
