Title,Project ID,Logline,Genre,Lane,Creator/Author/Director,Priority Score,Subgenre/Tags,Urgency Label,Discovery Stage,Country/Language,Platform/Source,Why It Matters,Signal/Proof,Source Link,Rights Status,Rights Holder,Contact/Rep,Adaptation Format,Comps,Heat Score,Concept Score,Adaptability Score,Rights Opportunity Score,Studio Fit Score,Next Action Status,Owner,Next Step,Last Updated,Notes,Project Cover,Search Keywords,Original Release / Publication Date,My Picks,Action Items,Country,Votes,Year Written,Script Status,Format,Script PDF
The Prospect,P-1052,Michael Jordan uses a year as a baseball prospect to find himself after his father's death.,Drama,Unproduced Script,Ben Epstein,0,,Low,,,,,,https://8flix.com/scripts/unproduced/2017-part-6#prospect-the,,,,,,,,,,,,Adam,,,On the 2017 Black List. Based on Michael Jordan's year as a baseball prospect.,,,,,,,7,2017,Unproduced,Feature,
Queen Elizabeth,P-1053,"An uptight, high-achieving, black post-grad who becomes (increasingly) irreverent and (slightly) destructive when she realizes that the life she's living is not the life she wants.",Drama,Unproduced Script,Shatara Michelle Ford,0,,Low,,,,,,https://8flix.com/scripts/unproduced/2017-part-6#queen-elizabeth,,,,,,,,,,,,Adam,,,On the 2017 Black List.,,,,,,,6,2017,Unproduced,Feature,
Ruin,P-1055,A nameless ex-Nazi captain must navigate the ruins of post-WWII Germany to atone for his crimes during the war by hunting down and killing the surviving members of his former SS death squad.,Thriller,Unproduced Script,Matthew Firpo & Ryan Firpo,0,,Low,,,,,,https://8flix.com/scripts/unproduced/2017-part-6#ruin,,,,,,,,,,,,Adam,,,On the 2017 Black List — #1 overall (top-voted script of 2017).,,,,,,,68,2017,Unproduced,Feature,
Ruthless,P-1056,"After she is diagnosed with terminal brain cancer, a former assassin must carry out one last assignment in order to ensure her daughter's future.",Action,Unproduced Script,John Swetnam,0,,Low,,,,,,https://8flix.com/scripts/unproduced/2017-part-6#ruthless,,,,,,,,,,,,Adam,,,On the 2017 Black List — #19 overall.,,,,,,,13,2017,Unproduced,Feature,
Skyward,P-1058,The true story of two families who attempt to escape over the Berlin Wall using a hot air balloon in 1979.,Drama,Unproduced Script,Joe Ballarini,0,,Low,,,,,,https://8flix.com/scripts/unproduced/2017-part-7#skyward,,,,,,,,,,,,Adam,,,On the 2017 Black List. Based on the true story of the 1979 Berlin Wall balloon escape.,,,,,,,6,2017,Unproduced,Feature,
Sleep Well Tonight,P-1059,"Behind the walls of a maximum security prison, a naïve teenage inmate and a rookie correctional officer are forced into a drug-smuggling operation, while a looming conflict between rival gang members threatens to boil over.",Thriller,Unproduced Script,Frederik With-Seidelin Skov,0,,Low,,,,,,https://8flix.com/scripts/unproduced/2017-part-7#sleep-well-tonight,,,,,,,,,,,,Adam,,,On the 2017 Black List — #8 overall.,,,,,,,18,2017,Unproduced,Feature,
Social Justice Warrior,P-1061,"When a liberal, white, college sophomore who knows exactly how to fix society accuses her equally liberal professor of hate speech, it throws the campus and both their lives into chaos as they wage war over the right way to stop discrimination.",Comedy,Unproduced Script,Emma Fletcher & Brett Weiner,0,,Low,,,,,,https://8flix.com/scripts/unproduced/2017-part-7#social-justice-warrior,,,,,,,,,,,,Adam,,,On the 2017 Black List.,,,,,,,7,2017,Unproduced,Feature,
Strongman,P-1062,"Based on the confusing, sometimes offensive, borderline-insane memories of David Prowse, the irascible Englishman behind Darth Vader's mask.",Comedy,Unproduced Script,Nicholas Jacobson-Larson & Dalton Leeb,0,,Low,,,,,,https://8flix.com/scripts/unproduced/2017-part-7#strongman,,,,,,,,,,,,Adam,,,On the 2017 Black List. Based on the memories of David Prowse (Darth Vader).,,,,,,,8,2017,Unproduced,Feature,
The Thing About Jellyfish,P-1063,"After her best friend drowns, a seventh-grade girl is convinced the true cause of the tragedy was a rare jellyfish sting. Retreating into a silent world of imagination, she crafts a plan to prove her theory.",Drama,Unproduced Script,Molly Smith Metzler,0,,Low,,,,,,https://8flix.com/scripts/unproduced/2017-part-7#thing-about-jellyfish-the,,,,,,,,,,,,Adam,,,On the 2017 Black List. Based on the novel by Ali Benjamin.,,,,,,,7,2017,Unproduced,Feature,
This is Jane,P-1064,"An ordinary group of women provide 11,000 safe, illegal abortions in Chicago from 1968 through 1973.",Drama,Unproduced Script,Daniel Loflin,0,,Low,,,,,,https://8flix.com/scripts/unproduced/2017-part-7#this-is-jane,,,,,,,,,,,,Adam,,,On the 2017 Black List. Based on Laura Kaplan's book about the Jane Collective.,,,,,,,9,2017,Unproduced,Feature,
Trapline,P-1065,A captive boy's lifestyle is upended when his abductor asks for his help kidnapping a second child.,Thriller,Unproduced Script,Brett Treacy & Dan Woodward,0,,Low,,,,,,https://8flix.com/scripts/unproduced/2017-part-7#trapline,,,,,,,,,,,,Adam,,,On the 2017 Black List — #10 overall.,,,,,,,16,2017,Unproduced,Feature,
V.I.N.,P-1066,"As Alex Haley struggles to write the autobiography of Malcolm X, his editor at Playboy assigns him a new interview: George Lincoln Rockwell, head of the American Nazi Party.",Drama,Unproduced Script,Chiara Towne,0,,Low,,,,,,https://8flix.com/scripts/unproduced/2017-part-8#v-i-n,,,,,,,,,,,,Adam,,,On the 2017 Black List. Based on the true story of Alex Haley interviewing George Lincoln Rockwell.,,,,,,,14,2017,Unproduced,Feature,
Valedictorian,P-1067,"An obsessive type-A student vows to secure the valedictorian title before school ends by any means necessary, even murder.",Thriller,Unproduced Script,Cosmo Carlson,0,,Low,,,,,,https://8flix.com/scripts/unproduced/2017-part-8#valedictorian,,,,,,,,,,,,Adam,,,On the 2017 Black List.,,,,,,,12,2017,Unproduced,Feature,
"When in Doubt, Seduce",P-1068,The true story of the early relationship between Elaine May and Mike Nichols.,Comedy,Unproduced Script,Allie Hagan,0,,Low,,,,,,https://8flix.com/scripts/unproduced/2017-part-8#when-in-doubt-seduce,,,,,,,,,,,,Adam,,,On the 2017 Black List — #11 overall. Based on the true story of Elaine May and Mike Nichols.,,,,,,,16,2017,Unproduced,Feature,
When Lightning Strikes,P-1069,"The story of 25-year-old Joanne Rowling as she weathers first loves, unexpected pregnancies, lost jobs, and depression on her journey to create Harry Potter.",Drama,Unproduced Script,Anna Klassen,0,,Low,,,,,,https://8flix.com/scripts/unproduced/2017-part-8#when-lightning-strikes,,,,,,,,,,,,Adam,,,On the 2017 Black List — #6 overall. Based on the life of J.K. Rowling.,,,,,,,20,2017,Unproduced,Feature,
Where I End,P-1070,"In a world where your life can be saved, uploaded to a computer, and restarted in the case of your untimely demise, a husband returns from the dead, suspecting his wife may have been involved in his death.",Sci-Fi,Unproduced Script,Imran Zaidi,0,,Low,,,,,,https://8flix.com/scripts/unproduced/2017-part-8#where-i-end,,,,,,,,,,,,Adam,,,On the 2017 Black List — #5 overall.,,,,,,,22,2017,Unproduced,Feature,
The White Devils,P-1071,"Cassius raises his sons, Malcolm and Mandela, isolated and alone in the woods. They have never met another person in their entire lives. When they find a mysterious wounded white girl, June, alone and lost in their woods, prejudice, lies and love set them on a collision course with the real world that puts all their lives at risk.",Thriller,Unproduced Script,Leon Hendrix III,0,,Low,,,,,,https://8flix.com/scripts/unproduced/2017-part-8#white-devils-the,,,,,,,,,,,,Adam,,,On the 2017 Black List.,,,,,,,6,2017,Unproduced,Feature,
Wyler,P-1072,"With Hitler laying waste to Europe and the United States refusing to answer the call to war, Jewish filmmaker William Wyler risks his career to make MRS. MINIVER, the most effective propaganda film of all time.",Drama,Unproduced Script,Michael Moskowitz,0,,Low,,,,,,https://8flix.com/scripts/unproduced/2017-part-8#wyler,,,,,,,,,,,,Adam,,,On the 2017 Black List. Based on the true story of William Wyler making Mrs. Miniver.,,,,,,,9,2017,Unproduced,Feature,
Allison Adams,P-1074,"A little girl goes missing in a small town, and the key to finding her resides with four disparate women who share nothing in common except for the young girl's name...Allison Adams.",Thriller,Unproduced Script,Devon Graye,0,,Low,,,,,,https://8flix.com/scripts/unproduced/2016-part-1#allison-adams,,,,,,,,,,,,Adam,,,On the 2016 Black List.,,,,,,,6,2016,Unproduced,Feature,
American Rebel,P-1076,"The true story of Deborah Sampson, a woman from Massachusetts who risked her life by disguising herself as a man and joining the Continental Army to help fight for independence during the Revolutionary War.",Drama,Unproduced Script,Christopher Cosmos,0,,Low,,,,,,https://8flix.com/scripts/unproduced/2016-part-1#american-rebel,,,,,,,,,,,,Adam,,,On the 2016 Black List. Based on the true story of Deborah Sampson.,,,,,,,9,2016,Unproduced,Feature,
Barbarian,P-1078,"Based on the true story of Boudicca, a queen and warrior of the British Celtic Iceni tribe who led an uprising against the occupying forces of the Roman Empire.",Action,Unproduced Script,Rosalind Ross,0,,Low,,,,,,https://8flix.com/scripts/unproduced/2016-part-1#barbarian,,,,,,,,,,,,Adam,,,On the 2016 Black List. Based on the true story of Boudicca. (Distinct from the 2022 horror film 'Barbarian.'),,,,,,,11,2016,Unproduced,Feature,
Battle of Alcatraz,P-1079,A plan to escape from Alcatraz prison turns into a battle and hostage crisis that pits armed prisoners against US Army troops for two full days.,Action,Unproduced Script,Neil Widener & Gavin James,0,,Low,,,,,,https://8flix.com/scripts/unproduced/2016-part-1#battle-of-alcatraz,,,,,,,,,,,,Adam,,,On the 2016 Black List. Based on the true story of the 1946 Battle of Alcatraz.,,,,,,,14,2016,Unproduced,Feature,
Bitter Pill,P-1080,"When an out-of-work divorced mother stops taking the court-ordered medication that made her feel like a zombie, her brazenly immoral, fifteen-year-old imaginary friend appears to get her life back on track.",Comedy,Unproduced Script,Turner Hay,0,,Low,,,,,,https://8flix.com/scripts/unproduced/2016-part-1#bitter-pill,,,,,,,,,,,,Adam,,,On the 2016 Black List.,,,,,,,6,2016,Unproduced,Feature,
Blonde Ambition,P-1081,"In 1980s New York, Madonna struggles to get her first album released while navigating fame, romance, and a music industry that views women as disposable.",Drama,Unproduced Script,Elyse Hollander,0,,Low,,,,,,https://8flix.com/scripts/unproduced/2016-part-1#blonde-ambition,,,,,,,,,,,,Adam,,,On the 2016 Black List — #1 overall (top-voted script of 2016). Based on the life of Madonna.,,,,,,,48,2016,Unproduced,Feature,
Boyfriend Material,P-1082,"In the near future, a heartbroken girl who hates technology participates in an experiment that allows you to program a robot into your dream man.",Romance,Unproduced Script,Mackenzie Dohr,0,,Low,,,,,,https://8flix.com/scripts/unproduced/2016-part-1#boyfriend-material,,,,,,,,,,,,Adam,,,On the 2016 Black List.,,,,,,,8,2016,Unproduced,Feature,
The Builder,P-1083,"A look inside the tortuous drama of Donald Trump's first Manhattan real estate deal, his relationships with troubled older brother Freddy and famed fixer Roy Cohn, and how they all created the Trump of today.",Drama,Unproduced Script,Tom Cartier,0,,Low,,,,,,https://8flix.com/scripts/unproduced/2016-part-1#builder-the,,,,,,,,,,,,Adam,,,On the 2016 Black List. Based on the early career of Donald Trump and Roy Cohn.,,,,,,,11,2016,Unproduced,Feature,
Burn Run,P-1084,"In war-torn Afghanistan, an American mercenary team is hired to escort a 20-ton heroin seizure bound for destruction but get caught up in a botched drug deal when their leader goes rogue, forcing them to overcome various enemies who wish to steal it.",Action,Unproduced Script,Matt Tente,0,,Low,,,,,,https://8flix.com/scripts/unproduced/2016-part-1#burn-run,,,,,,,,,,,,Adam,,,On the 2016 Black List.,,,,,,,7,2016,Unproduced,Feature,
The Burning Season,P-1085,"A primatologist takes her teenage daughter to a remote region of Madagascar, where her determination to save endangered lemurs puts their relationship and safety at risk.",Drama,Unproduced Script,Jenny Halper,0,,Low,,,,,,https://8flix.com/scripts/unproduced/2016-part-1#burning-season-the,,,,,,,,,,,,Adam,,,On the 2016 Black List. Based on the short story by Laura Van Den Berg.,,,,,,,8,2016,Unproduced,Feature,
Captain Infinity,P-1086,"When his comic book obsessed five-year-old brother is diagnosed with cancer, Oscar Ruiz attempts to shield him from the truth by convincing him that his 'treatment' is all part of a top secret program to become a superhero.",Drama,Unproduced Script,Harry Tarre,0,,Low,,,,,,https://8flix.com/scripts/unproduced/2016-part-2#captain-infinity,,,,,,,,,,,,Adam,,,On the 2016 Black List.,,,,,,,6,2016,Unproduced,Feature,
Carnada,P-1087,"In post-Cuban Missile Crisis Miami, an ambitious young CIA agent receives a career-making opportunity in becoming the case officer for a charismatic Cuban ambassador offering to help eliminate Fidel Castro. As their relationship grows, however, he begins to question the mission and the true motives of his superiors.",Thriller,Unproduced Script,Katharine Werner,0,,Low,,,,,,https://8flix.com/scripts/unproduced/2016-part-2#carnada,,,,,,,,,,,,Adam,,,On the 2016 Black List. Based on true events.,,,,,,,6,2016,Unproduced,Feature,
Contingency Protocol,P-1088,"When futuristic technology renders the Federal Witness Protection Program obsolete, the U.S. Government begins using Time Travel to hide high-profile witnesses in the Past. When a security breach occurs, a U.S. Marshal and her witness struggle to find their way back to the Present Day while evading assassins.",Sci-Fi,Unproduced Script,Mark Townend,0,,Low,,,,,,https://8flix.com/scripts/unproduced/2016-part-2#contingency-protocol,,,,,,,,,,,,Adam,,,On the 2016 Black List.,,,,,,,8,2016,Unproduced,Feature,
Dark Money,P-1089,The true story of a young stock trader who goes to work for billionaire tycoon Steve Cohen and gets involved in the biggest insider trading scandal in history.,Drama,Unproduced Script,Matt Fruchtman,0,,Low,,,,,,https://8flix.com/scripts/unproduced/2016-part-2#dark-money,,,,,,,,,,,,Adam,,,On the 2016 Black List — #9 overall. Based on the true story of the SAC Capital insider trading scandal.,,,,,,,21,2016,Unproduced,Feature,
A Deconstruction of Reality,P-1090,"Tasked with finding a game changing take for the sixth Jason Bourne movie, Tom Milton goes deep down the rabbit hole of cracking the story. With the guidance (and abuse) of a professor from his past and Bourne himself, Tom begins workshopping scenes that begin to bleed into real life in unexpected ways.",Drama,Unproduced Script,Mattson Tomlin,0,,Low,,,,,,https://8flix.com/scripts/unproduced/2016-part-2#deconstruction-of-reality-a,,,,,,,,,,,,Adam,,,On the 2016 Black List.,,,,,,,8,2016,Unproduced,Feature,
Donziger,P-1091,"After twenty years, Steven Donziger wins a $19 billion verdict against Chevron for poisoning rural lands in Ecuador. Chevron responds by hiring heavy hitter Randy Mastro determined to have the entire verdict thrown out.",Drama,Unproduced Script,Jay Carson & Matt Bai,0,,Low,,,,,,https://8flix.com/scripts/unproduced/2016-part-2#donziger,,,,,,,,,,,,Adam,,,On the 2016 Black List. Based on the true story of Steven Donziger vs. Chevron.,,,,,,,6,2016,Unproduced,Feature,
Escape From Sarajevo,P-1092,"Based on the author's father's escape from Sarajevo in 1992, the harrowing and heartbreaking tale of one man's mission to get back to his family.",Drama,Unproduced Script,Vanya Asher,0,,Low,,,,,,https://8flix.com/scripts/unproduced/2016-part-2#escape-from-sarajevo,,,,,,,,,,,,Adam,,,On the 2016 Black List. Based on the author's father's escape from Sarajevo in 1992.,,,,,,,6,2016,Unproduced,Feature,
Fairy Godmother,P-1093,"When sought after Fairy Godmother Faye is hired by a mind-bogglingly gorgeous teenage client, Kenzie, to find her true love with the hottest prince in the land, Faye finds herself facing an unfamiliar challenge when the prince starts falling for her instead.",Romance,Unproduced Script,Chiara Atik,0,,Low,,,,,,https://8flix.com/scripts/unproduced/2016-part-2#fairy-godmother,,,,,,,,,,,,Adam,,,On the 2016 Black List.,,,,,,,15,2016,Unproduced,Feature,
The Fall,P-1094,"Finding themselves in the middle of an alien invasion, a newly divorced couple must survive a dangerous real-time journey on foot from downtown Atlanta to the suburbs, where their young children are home alone.",Sci-Fi,Unproduced Script,Pete Bridges,0,,Low,,,,,,https://8flix.com/scripts/unproduced/2016-part-2#fall-the,,,,,,,,,,,,Adam,,,On the 2016 Black List.,,,,,,,7,2016,Unproduced,Feature,
Fruitcake,P-1096,The remarkable true story of an unremarkable church-going accountant who stole $17 million in the biggest fruitcake heist of all time.,Comedy,Unproduced Script,Trey Selman,0,,Low,,,,,,https://8flix.com/scripts/unproduced/2016-part-2#fruitcake,,,,,,,,,,,,Adam,,,On the 2016 Black List. Based on a true story.,,,,,,,8,2016,Unproduced,Feature,
The Gun Show,P-1097,"A famous top cop wakes up twenty years after a shootout and is reinstated to solve the case that killed his old partner. Only problem: he's a bull in a China shop, and 2016 is a very different time than the 1990s world he's used to. To teach him the ropes, he's paired with his old partner's son, a risk averse traffic cop.",Action,Unproduced Script,Lucas Carter,0,,Low,,,,,,https://8flix.com/scripts/unproduced/2016-part-3#gun-show-the,,,,,,,,,,,,Adam,,,On the 2016 Black List.,,,,,,,7,2016,Unproduced,Feature,
Hart You,P-1099,Estranged siblings pose as a married couple in the Amalfi Coast to win a cash prize.,Comedy,Unproduced Script,Zoe McCarthy,0,,Low,,,,,,https://8flix.com/scripts/unproduced/2016-part-3#hart-you,,,,,,,,,,,,Adam,,,On the 2016 Black List.,,,,,,,12,2016,Unproduced,Feature,
Hummingbird,P-1102,"A black-ops assassin's latest mark forces her to question the truth of her identity and ultimately confront the unsettling fact that she's more than a hired gun, she's an entirely new breed of weapon.",Action,Unproduced Script,John Tyler Mclain,0,,Low,,,,,,https://8flix.com/scripts/unproduced/2016-part-3#hummingbird,,,,,,,,,,,,Adam,,,On the 2016 Black List.,,,,,,,7,2016,Unproduced,Feature,
The Hunchback,P-1103,"Defying an isolationist, fear-mongering government, a gypsy revolutionary, a mutinous soldier, and a deaf hunchback become the champions of human tolerance and the symbols for a peaceful future in a dystopian revision of Victor Hugo's novel.",Drama,Unproduced Script,Topher Rhys-Lawrence,0,,Low,,,,,,https://8flix.com/scripts/unproduced/2016-part-3#hunchback-the,,,,,,,,,,,,Adam,,,On the 2016 Black List. A dystopian revision of Victor Hugo's novel.,,,,,,,8,2016,Unproduced,Feature,
James Cameron's Titanic,P-1109,"A 'Rosencrantz and Guildenstern Are Dead' take on Titanic. An overprotective mother attempts to keep her teenage daughter, young son, and rowdy sister together while sailing on the doomed voyage of the Titanic in 1912.",Comedy,Unproduced Script,Kate D'Angelo,0,,Low,,,,,,https://8flix.com/scripts/unproduced/2016-part-4#james-camerons-titanic,,,,,,,,,,,,Adam,,,On the 2016 Black List.,,,,,,,12,2016,Unproduced,Feature,
The King of L.A.,P-1110,"Set in the 1980s, based on the true story of a man who went from star DEA agent to convicted drug trafficker in the worst corruption scandal in DEA history.",Drama,Unproduced Script,Chris Bremner,0,,Low,,,,,,https://8flix.com/scripts/unproduced/2016-part-4#king-of-l-a-the,,,,,,,,,,,,Adam,,,On the 2016 Black List. Based on a true story.,,,,,,,13,2016,Unproduced,Feature,
Kings Canyon,P-1111,"At the height of the Cold War, Air Force pilot Lieutenant David Steeves vanishes over the Sierra Nevada mountains in a high-value jet. Fifty-four days later, left for dead, he crawls out of the wild with an impossible tale of survival. The media and military brand him a hero, only to call him into question when discrepancies in his story point to his being a hoax, or worse — a traitor.",Drama,Unproduced Script,Evan Parter & Paul Hilborn,0,,Low,,,,,,https://8flix.com/scripts/unproduced/2016-part-4#kings-canyon,,,,,,,,,,,,Adam,,,On the 2016 Black List. Based on the true story of David Steeves.,,,,,,,10,2016,Unproduced,Feature,
The Kings of Maine,P-1112,"Living with his wife and child in a trailer while working as a janitor, Stephen King struggles with alcoholism and his own dark history as he attempts to complete Carrie.",Drama,Unproduced Script,Kathy Charles,0,,Low,,,,,,https://8flix.com/scripts/unproduced/2016-part-4#kings-of-maine-the,,,,,,,,,,,,Adam,,,On the 2016 Black List. Based on the early life of Stephen King.,,,,,,,15,2016,Unproduced,Feature,
The Last Days of Night,P-1113,Attorney Paul Cravath takes on Thomas Edison in a legal battle to determine whether Edison or his rival George Westinghouse will provide the electricity to light America.,Drama,Unproduced Script,Graham Moore,0,,Low,,,,,,https://8flix.com/scripts/unproduced/2016-part-4#last-days-of-night-the,,,,,,,,,,,,Adam,,,On the 2016 Black List. Based on Graham Moore's novel.,,,,,,,10,2016,Unproduced,Feature,
Layla...and Other Assorted Love Songs,P-1115,"Based on the lives and times of Eric Clapton, George Harrison, and Pattie Boyd and the tumultuous love triangle that inspired an entire generation of music.",Drama,Unproduced Script,Derek Weissbein,0,,Low,,,,,,https://8flix.com/scripts/unproduced/2016-part-4#layla-and-other-assorted-love-songs,,,,,,,,,,,,Adam,,,"On the 2016 Black List. Based on the lives of Eric Clapton, George Harrison, and Pattie Boyd.",,,,,,,15,2016,Unproduced,Feature,
Let the Evil Go West,P-1116,"In the 1800s, a father desperate to care for his family finds a barrel of gold, that may be less fortune than great curse.",Western,Unproduced Script,Carlos Rios,0,,Low,,,,,,https://8flix.com/scripts/unproduced/2016-part-4#let-the-evil-go-west,,,,,,,,,,,,Adam,,,On the 2016 Black List.,,,,,,,13,2016,Unproduced,Feature,
A Letter from Rose Kennedy,P-1117,"Told through a series of letters to family members, the tragic true story of Rosemary Kennedy, a vibrant, passionate young woman and oldest daughter of Joe and Rose Kennedy. Born with a severe learning disability, Rosemary so worried her father with her erratic behavior that he believed the stigma of mental illness in the family would ruin his plans to build a political dynasty. He hid her away in convents and sanitariums and ultimately had her lobotomized.",Drama,Unproduced Script,Nick Yarborough,0,,Low,,,,,,https://8flix.com/scripts/unproduced/2016-part-4#letter-from-rose-kennedy-a,,,,,,,,,,,,Adam,,,On the 2016 Black List — #10 overall. Based on the true story of Rosemary Kennedy.,,,,,,,20,2016,Unproduced,Feature,
Liberty,P-1118,"The truly astonishing tale of Frédéric Auguste Bartholdi – the French sculptor wholly responsible for designing, building, and delivering the Statue of Liberty across the Atlantic to where it stands today.",Drama,Unproduced Script,Jayson Rothwell,0,,Low,,,,,,https://8flix.com/scripts/unproduced/2016-part-4#liberty,,,,,,,,,,,,Adam,,,On the 2016 Black List. Based on the true story of Frédéric Auguste Bartholdi and the Statue of Liberty.,,,,,,,10,2016,Unproduced,Feature,
Linda and Monica,P-1120,"The absolutely crazy true story of the relationship between Monica Lewinsky and Linda Tripp, the woman who nearly destroyed the Clinton presidency - and herself in the process.",Drama,Unproduced Script,Flint Wainess,0,,Low,,,,,,https://8flix.com/scripts/unproduced/2016-part-4#linda-and-monica,,,,,,,,,,,,Adam,,,On the 2016 Black List — #11 overall. Based on the true story of Monica Lewinsky and Linda Tripp.,,,,,,,20,2016,Unproduced,Feature,
Man Alive,P-1121,"After an alien invasion takes over the minds of humankind, one survivor known as 'Man' must make peace with the alien force to fight a greater evil.",Sci-Fi,Unproduced Script,Joseph J. Greenberg & David Robert Mitchell,0,,Low,,,,,,https://8flix.com/scripts/unproduced/2016-part-5#man-alive,,,,,,,,,,,,Adam,,,On the 2016 Black List.,,,,,,,14,2016,Unproduced,Feature,
Maximum King!,P-1122,"An outlandish, surreal imagining of how in 1985 Stephen King wrote and directed his horror classic MAXIMUM OVERDRIVE.",Comedy,Unproduced Script,Shay Hatten,0,,Low,,,,,,https://8flix.com/scripts/unproduced/2016-part-5#maximum-king,,,,,,,,,,,,Adam,,,On the 2016 Black List. A surreal imagining of Stephen King directing Maximum Overdrive.,,,,,,,15,2016,Unproduced,Feature,
The Miserable Adventures of Burt Squire,P-1124,The unbelievable true story of a family man from Alaska in the midst of a midlife crisis who embarks on what he hoped would be a dream sailing vacation but ends up shipwrecked in the Atlantic Ocean with a charming but psychotic sea captain who has decided to stop taking his medication.,Thriller,Unproduced Script,Ben Bolea,0,,Low,,,,,,https://8flix.com/scripts/unproduced/2016-part-5#miserable-adventures-of-burt-squire-the,,,,,,,,,,,,Adam,,,On the 2016 Black List — #13 overall. Based on a true story.,,,,,,,18,2016,Unproduced,Feature,
Mr. Toy,P-1125,"The true story of Marvin Glass, brilliant, charismatic, self-loathing, paranoid, demanding – and probably the greatest toy inventor of all time.",Drama,Unproduced Script,Chai Hecht,0,,Low,,,,,,https://8flix.com/scripts/unproduced/2016-part-5#mr-toy,,,,,,,,,,,,Adam,,,On the 2016 Black List. Based on the true story of Marvin Glass.,,,,,,,6,2016,Unproduced,Feature,
Northeast Kingdom,P-1126,"When Angie witnesses the betrayal and murder of her father during a smuggler's drop, the vigilant and determined young woman calls in the help of a mysterious female assassin to seek revenge against all those responsible.",Thriller,Unproduced Script,Alex R. Johnson,0,,Low,,,,,,https://8flix.com/scripts/unproduced/2016-part-5#northeast-kingdom,,,,,,,,,,,,Adam,,,On the 2016 Black List.,,,,,,,12,2016,Unproduced,Feature,
